concept_id,concept_name,domain_id,vocabulary_id,concept_class_id,standard_concept,concept_code,valid_start_date,valid_end_date,invalid_reason
72459,Closed fracture of two ribs,Condition,SNOMED,Disorder,S,3291007,2002-01-31,2099-12-31,NA
72460,Open fracture of seven ribs,Condition,SNOMED,Disorder,S,69029002,2002-01-31,2099-12-31,NA
73041,Closed fracture of five ribs,Condition,SNOMED,Disorder,S,17633000,2002-01-31,2099-12-31,NA
73614,Closed fracture of seven ribs,Condition,SNOMED,Disorder,S,20121009,2002-01-31,2099-12-31,NA
73884,Closed fracture of three ribs,Condition,SNOMED,Disorder,S,79546008,2002-01-31,2099-12-31,NA
74179,Open fracture of T7-T12 level with spinal cord injury,Condition,SNOMED,Disorder,S,3446000,2002-01-31,2099-12-31,NA
74182,Open fracture of ischium,Condition,SNOMED,Disorder,S,76911006,2002-01-31,2099-12-31,NA
74188,Closed fracture of rib,Condition,SNOMED,Disorder,S,60667009,2002-01-31,2099-12-31,NA
74495,Open fracture of five ribs,Condition,SNOMED,Disorder,S,44039000,2002-01-31,2099-12-31,NA
74496,Open fracture of six ribs,Condition,SNOMED,Disorder,S,77546004,2002-01-31,2099-12-31,NA
75090,Open fracture of three ribs,Condition,SNOMED,Disorder,S,22000002,2002-01-31,2099-12-31,NA
75096,Anterior cord syndrome due to open fracture of T7-T12 level,Condition,SNOMED,Disorder,S,27937002,2002-01-31,2099-12-31,NA
75932,Open fracture of pelvis,Condition,SNOMED,Disorder,S,15474008,2002-01-31,2099-12-31,NA
75941,Closed fracture of one rib,Condition,SNOMED,Disorder,S,45356009,2002-01-31,2099-12-31,NA
75942,Open fracture of rib,Condition,SNOMED,Disorder,S,45910007,2002-01-31,2099-12-31,NA
75943,Open fracture of pubis,Condition,SNOMED,Disorder,S,71220005,2002-01-31,2099-12-31,NA
76240,Closed fracture pubis,Condition,SNOMED,Disorder,S,208164008,2002-01-31,2099-12-31,NA
76825,Open fracture of four ribs,Condition,SNOMED,Disorder,S,58154005,2002-01-31,2099-12-31,NA
77112,Open fracture of scapula,Condition,SNOMED,Disorder,S,47864008,2002-01-31,2099-12-31,NA
77115,Multiple open fractures of pelvis with disruption of pelvic circle,Condition,SNOMED,Disorder,S,86731008,2002-01-31,2099-12-31,NA
77129,Closed fracture of pelvis,Condition,SNOMED,Disorder,S,91037003,2002-01-31,2099-12-31,NA
77362,Stress fracture of pelvis,Condition,SNOMED,Disorder,S,430907000,2008-07-31,2099-12-31,NA
77392,Open fracture of eight OR more ribs,Condition,SNOMED,Disorder,S,10568008,2002-01-31,2099-12-31,NA
77405,Open fracture of acetabulum,Condition,SNOMED,Disorder,S,77598002,2002-01-31,2099-12-31,NA
77701,Closed fracture of six ribs,Condition,SNOMED,Disorder,S,89636007,2002-01-31,2099-12-31,NA
77702,Multiple closed fractures of pelvis with disruption of pelvic circle,Condition,SNOMED,Disorder,S,59962009,2002-01-31,2099-12-31,NA
78273,Closed fracture of multiple ribs,Condition,SNOMED,Disorder,S,12204004,2002-01-31,2099-12-31,NA
78276,Open fracture of ilium,Condition,SNOMED,Disorder,S,60214001,2002-01-31,2099-12-31,NA
78574,Open fracture of multiple ribs,Condition,SNOMED,Disorder,S,28081005,2002-01-31,2099-12-31,NA
79938,Closed fracture of scapula,Condition,SNOMED,Disorder,S,29749002,2002-01-31,2099-12-31,NA
80227,Open fracture of two ribs,Condition,SNOMED,Disorder,S,47402002,2002-01-31,2099-12-31,NA
80229,Open fracture of one rib,Condition,SNOMED,Disorder,S,44932007,2002-01-31,2099-12-31,NA
80541,Closed fracture of eight OR more ribs,Condition,SNOMED,Disorder,S,90863004,2002-01-31,2099-12-31,NA
80852,Closed fracture of four ribs,Condition,SNOMED,Disorder,S,39335003,2002-01-31,2099-12-31,NA
80861,Closed fracture of ischium,Condition,SNOMED,Disorder,S,36417005,2002-01-31,2099-12-31,NA
81141,Closed fracture of ilium,Condition,SNOMED,Disorder,S,17616007,2002-01-31,2099-12-31,NA
81696,Closed fracture of acetabulum,Condition,SNOMED,Disorder,S,33118001,2002-01-31,2099-12-31,NA
133610,"Open fracture scapula, coracoid",Condition,SNOMED,Disorder,S,208232005,2002-01-31,2099-12-31,NA
137111,"Closed fracture scapula, coracoid",Condition,SNOMED,Disorder,S,208225001,2002-01-31,2099-12-31,NA
137695,Anterior cord syndrome due to closed fracture of T1-T6 level,Condition,SNOMED,Disorder,S,14493003,2002-01-31,2099-12-31,NA
137997,Open fracture of acromial process of scapula,Condition,SNOMED,Disorder,S,38404000,2002-01-31,2099-12-31,NA
138582,Closed fracture of acromial process of scapula,Condition,SNOMED,Disorder,S,111639006,2002-01-31,2099-12-31,NA
138876,Closed fracture of T1-T6 level with spinal cord injury,Condition,SNOMED,Disorder,S,31882001,2002-01-31,2099-12-31,NA
141143,Anterior cord syndrome due to open fracture of T1-T6 level,Condition,SNOMED,Disorder,S,49497005,2002-01-31,2099-12-31,NA
141972,Open fracture of T1-T6 level with spinal cord injury,Condition,SNOMED,Disorder,S,16695002,2002-01-31,2099-12-31,NA
194180,Open fracture of lumbar vertebra with spinal cord injury,Condition,SNOMED,Disorder,S,48956000,2002-01-31,2099-12-31,NA
195948,Closed fracture of lumbar vertebra with spinal cord injury,Condition,SNOMED,Disorder,S,49747005,2002-01-31,2099-12-31,NA
312462,Anterior cord syndrome due to closed fracture of T7-T12 level,Condition,SNOMED,Disorder,S,13194006,2002-01-31,2099-12-31,NA
313608,Closed fracture of T7-T12 level with spinal cord injury,Condition,SNOMED,Disorder,S,72513001,2002-01-31,2099-12-31,NA
434499,Open fracture of sternum,Condition,SNOMED,Disorder,S,87225004,2002-01-31,2099-12-31,NA
434769,Flail chest,Condition,SNOMED,Disorder,S,78011002,2002-01-31,2099-12-31,NA
434770,Closed fracture of bones of trunk,Condition,SNOMED,Disorder,S,31984004,2002-01-31,2099-12-31,NA
436832,Closed fracture of sternum,Condition,SNOMED,Disorder,S,66112004,2002-01-31,2099-12-31,NA
440545,Open fracture of bones of trunk,Condition,SNOMED,Disorder,S,66691008,2002-01-31,2099-12-31,NA
442348,Closed multiple fractures of lower limb with ribs AND sternum,Condition,SNOMED,Disorder,S,42109006,2002-01-31,2099-12-31,NA
444405,Open multiple fractures of lower limb with ribs AND sternum,Condition,SNOMED,Disorder,S,20594000,2002-01-31,2099-12-31,NA
606228,Pathological fracture of pelvis and femur,Condition,SNOMED,Disorder,S,1144497004,2021-07-31,2099-12-31,NA
606229,Fracture malunion of pelvis and femur,Condition,SNOMED,Disorder,S,1144498009,2021-07-31,2099-12-31,NA
759947,Open fracture of multiple right ribs,Condition,SNOMED,Disorder,S,10817461000119109,2015-03-01,2099-12-31,NA
760048,Open fracture of one right rib,Condition,SNOMED,Disorder,S,10832421000119108,2015-03-01,2099-12-31,NA
760089,Open fracture of multiple left ribs,Condition,SNOMED,Disorder,S,10836901000119107,2015-03-01,2099-12-31,NA
760257,Closed fracture of single right rib,Condition,SNOMED,Disorder,S,10925481000119107,2015-03-01,2099-12-31,NA
760258,Closed fracture of single left rib,Condition,SNOMED,Disorder,S,10925521000119107,2015-03-01,2099-12-31,NA
760259,Closed fracture of multiple right ribs,Condition,SNOMED,Disorder,S,10925561000119102,2015-03-01,2099-12-31,NA
760260,Closed fracture of multiple left ribs,Condition,SNOMED,Disorder,S,10925601000119102,2015-03-01,2099-12-31,NA
760441,Closed fracture of glenoid cavity of right scapula,Condition,SNOMED,Disorder,S,10933961000119106,2015-03-01,2099-12-31,NA
760442,Closed fracture of coracoid process of right scapula,Condition,SNOMED,Disorder,S,10934041000119109,2015-03-01,2099-12-31,NA
760443,Closed fracture of coracoid process of left scapula,Condition,SNOMED,Disorder,S,10934081000119104,2015-03-01,2099-12-31,NA
760444,Closed fracture of acromial process of right scapula,Condition,SNOMED,Disorder,S,10934121000119102,2015-03-01,2099-12-31,NA
760445,Closed fracture of acromial process of left scapula,Condition,SNOMED,Disorder,S,10934161000119107,2015-03-01,2099-12-31,NA
760490,Closed fracture of neck of right scapula,Condition,SNOMED,Disorder,S,10936281000119104,2015-03-01,2099-12-31,NA
760491,Closed fracture of body of right scapula,Condition,SNOMED,Disorder,S,10936361000119104,2015-03-01,2099-12-31,NA
760492,Closed fracture of body of left scapula,Condition,SNOMED,Disorder,S,10936401000119108,2015-03-01,2099-12-31,NA
760493,Closed fracture of right scapula,Condition,SNOMED,Disorder,S,10936441000119105,2015-03-01,2099-12-31,NA
760494,Closed fracture of left scapula,Condition,SNOMED,Disorder,S,10936481000119100,2015-03-01,2099-12-31,NA
760593,Open avulsion fracture of anterior inferior spine of left ilium,Condition,SNOMED,Disorder,S,11306161000119107,2015-03-01,2099-12-31,NA
760594,Closed avulsion fracture of anterior inferior spine of right ilium,Condition,SNOMED,Disorder,S,11306281000119105,2015-03-01,2099-12-31,NA
760595,Closed avulsion fracture of anterior inferior spine of left ilium,Condition,SNOMED,Disorder,S,11306321000119100,2015-03-01,2099-12-31,NA
760596,Closed avulsion fracture of anterior superior spine of right ilium,Condition,SNOMED,Disorder,S,11306361000119105,2015-03-01,2099-12-31,NA
760597,Closed fracture of right ilium,Condition,SNOMED,Disorder,S,11306441000119104,2015-03-01,2099-12-31,NA
760598,Open fracture of right pubis,Condition,SNOMED,Disorder,S,11306601000119104,2015-03-01,2099-12-31,NA
760599,Open fracture of left pubis,Condition,SNOMED,Disorder,S,11306641000119102,2015-03-01,2099-12-31,NA
760600,Stress fracture of right pubic ramus,Condition,SNOMED,Disorder,S,11306681000119107,2015-03-01,2099-12-31,NA
760601,Stress fracture of left pubic ramus,Condition,SNOMED,Disorder,S,11306721000119101,2015-03-01,2099-12-31,NA
760602,Closed fracture of right pubis,Condition,SNOMED,Disorder,S,11306761000119106,2015-03-01,2099-12-31,NA
760603,Closed fracture of left pubis,Condition,SNOMED,Disorder,S,11306801000119103,2015-03-01,2099-12-31,NA
760604,Closed fracture of right ischium,Condition,SNOMED,Disorder,S,11306921000119104,2015-03-01,2099-12-31,NA
760605,Closed fracture of posterior column of right acetabulum,Condition,SNOMED,Disorder,S,11307001000119109,2015-03-01,2099-12-31,NA
760606,Closed fracture of anterior column of right acetabulum,Condition,SNOMED,Disorder,S,11307081000119101,2015-03-01,2099-12-31,NA
760608,Closed fracture of posterior column of left acetabulum,Condition,SNOMED,Disorder,S,11307121000119104,2015-03-01,2099-12-31,NA
760609,Closed transverse and posterior wall fracture of right acetabulum,Condition,SNOMED,Disorder,S,11307161000119109,2015-03-01,2099-12-31,NA
760610,Closed fracture of left acetabulum,Condition,SNOMED,Disorder,S,11307281000119107,2015-03-01,2099-12-31,NA
760611,Closed transverse fracture of right acetabulum,Condition,SNOMED,Disorder,S,11307321000119102,2015-03-01,2099-12-31,NA
760612,Closed transverse fracture of left acetabulum,Condition,SNOMED,Disorder,S,11307361000119107,2015-03-01,2099-12-31,NA
760613,Closed fracture of anterior column and posterior column of right acetabulum,Condition,SNOMED,Disorder,S,11307401000119103,2015-03-01,2099-12-31,NA
760614,Closed fracture of anterior column and posterior column of left acetabulum,Condition,SNOMED,Disorder,S,11307441000119101,2015-03-01,2099-12-31,NA
760615,Closed fracture of anterior wall of right acetabulum,Condition,SNOMED,Disorder,S,11307641000119104,2015-03-01,2099-12-31,NA
760616,Closed fracture of posterior wall of right acetabulum,Condition,SNOMED,Disorder,S,11307721000119103,2015-03-01,2099-12-31,NA
760617,Closed fracture of posterior wall of left acetabulum,Condition,SNOMED,Disorder,S,11307761000119108,2015-03-01,2099-12-31,NA
760618,Closed fracture of medial wall of right acetabulum,Condition,SNOMED,Disorder,S,11307801000119100,2015-03-01,2099-12-31,NA
760619,Closed fracture of medial wall of left acetabulum,Condition,SNOMED,Disorder,S,11307841000119103,2015-03-01,2099-12-31,NA
760620,Open fracture of right acetabulum,Condition,SNOMED,Disorder,S,11308201000119103,2015-03-01,2099-12-31,NA
760667,Pathological fracture of left scapula due to osteoporosis,Condition,SNOMED,Disorder,S,11313321000119109,2015-09-01,2099-12-31,NA
760668,Pathological fracture of right scapula,Condition,SNOMED,Disorder,S,11313441000119105,2015-03-01,2099-12-31,NA
760669,Pathological fracture of left scapula,Condition,SNOMED,Disorder,S,11313481000119100,2015-09-01,2099-12-31,NA
760697,Pathological fracture of right rib,Condition,SNOMED,Disorder,S,11315281000119100,2015-03-01,2099-12-31,NA
760698,Pathological fracture of left rib,Condition,SNOMED,Disorder,S,11315321000119105,2015-03-01,2099-12-31,NA
760849,Fracture of right rib,Condition,SNOMED,Disorder,S,12020001000004102,2015-09-01,2099-12-31,NA
760851,Fracture of left rib,Condition,SNOMED,Disorder,S,12030001000004100,2015-09-01,2099-12-31,NA
761936,Fracture of posterior vertebral body of thoracic vertebra,Condition,SNOMED,Disorder,S,21920001000004109,2015-09-01,2099-12-31,NA
761998,Fracture of manubrium sterni,Condition,SNOMED,Disorder,S,28260001000004105,2015-09-01,2099-12-31,NA
763802,Open avulsion fracture of anterior inferior spine of ilium,Condition,SNOMED,Disorder,S,446561000124102,2015-03-01,2099-12-31,NA
764678,Compression fracture of lumbosacral spine,Condition,SNOMED,Disorder,S,5291000124100,2012-03-01,2099-12-31,NA
764899,"Compression fracture of thoracic vertebra, nontraumatic",Condition,SNOMED,Disorder,S,811000119108,2012-09-01,2099-12-31,NA
765000,Closed fracture of multiple left and right ribs,Condition,SNOMED,Disorder,S,10925641000119100,2015-03-01,2099-12-31,NA
765032,Closed avulsion fracture of anterior superior spine of left ilium,Condition,SNOMED,Disorder,S,11306401000119101,2015-03-01,2099-12-31,NA
765184,Closed fracture of left ilium,Condition,SNOMED,Disorder,S,11306481000119109,2015-03-01,2099-12-31,NA
765185,Closed fracture of left ischium,Condition,SNOMED,Disorder,S,11306961000119109,2015-03-01,2099-12-31,NA
765186,Closed fracture of right acetabulum,Condition,SNOMED,Disorder,S,11307201000119104,2015-03-01,2099-12-31,NA
765187,Closed fracture of anterior wall of left acetabulum,Condition,SNOMED,Disorder,S,11307681000119109,2015-03-01,2099-12-31,NA
765342,Closed fracture of glenoid cavity of left scapula,Condition,SNOMED,Disorder,S,10934001000119107,2015-03-01,2099-12-31,NA
765401,Sternal fracture with retrosternal contusion,Condition,SNOMED,Disorder,S,448321000124104,2015-09-01,2099-12-31,NA
1076428,Fracture of bone of thorax,Condition,SNOMED,Disorder,S,1343489000,2024-08-01,2099-12-31,NA
1076476,Open fracture of bone of thorax,Condition,SNOMED,Disorder,S,1344625007,2024-08-01,2099-12-31,NA
1244266,Central cord syndrome of lumbar spinal cord due to open spinal fracture,Condition,SNOMED,Disorder,S,1279876004,2023-12-01,2099-12-31,NA
1244267,Central cord syndrome of lumbar spinal cord due to closed spinal fracture,Condition,SNOMED,Disorder,S,1279877008,2023-12-01,2099-12-31,NA
1244269,Central cord syndrome of thoracic spinal cord due to closed fracture at T1-T6 level,Condition,SNOMED,Disorder,S,1279898008,2023-12-01,2099-12-31,NA
1244271,Central cord syndrome of thoracic spinal cord due to closed fracture at T7-T12 level,Condition,SNOMED,Disorder,S,1279909006,2023-12-01,2099-12-31,NA
1244272,Central cord syndrome of thoracic spinal cord due to open fracture at T1-T6 level,Condition,SNOMED,Disorder,S,1279915006,2023-12-01,2099-12-31,NA
1244273,Central cord syndrome of thoracic spinal cord due to open fracture at T7-T12 level,Condition,SNOMED,Disorder,S,1279921005,2023-12-01,2099-12-31,NA
1244837,Fracture of ramus of pubis,Condition,SNOMED,Disorder,S,1292974007,2023-11-01,2099-12-31,NA
1244839,Closed fracture of pubic ramus,Condition,SNOMED,Disorder,S,1292980004,2023-11-01,2099-12-31,NA
1244840,Open fracture of pubic ramus,Condition,SNOMED,Disorder,S,1292981000,2023-11-01,2099-12-31,NA
1450037,Fracture of first rib,Condition,SNOMED,Disorder,S,1354711006,2025-01-01,2099-12-31,NA
1450038,Fracture of second rib,Condition,SNOMED,Disorder,S,1354714003,2025-01-01,2099-12-31,NA
1450039,Fracture of third rib,Condition,SNOMED,Disorder,S,1354717005,2025-01-01,2099-12-31,NA
1450040,Fracture of fourth rib,Condition,SNOMED,Disorder,S,1354720002,2025-01-01,2099-12-31,NA
1450043,Fracture of fifth rib,Condition,SNOMED,Disorder,S,1354730006,2025-01-01,2099-12-31,NA
1450044,Fracture of sixth rib,Condition,SNOMED,Disorder,S,1354731005,2025-01-01,2099-12-31,NA
1450045,Fracture of seventh rib,Condition,SNOMED,Disorder,S,1354732003,2025-01-01,2099-12-31,NA
1450046,Fracture of eighth rib,Condition,SNOMED,Disorder,S,1354739007,2025-01-01,2099-12-31,NA
1450047,Fracture of ninth rib,Condition,SNOMED,Disorder,S,1354740009,2025-01-01,2099-12-31,NA
1450048,Fracture of tenth rib,Condition,SNOMED,Disorder,S,1354741008,2025-01-01,2099-12-31,NA
1450049,Fracture of eleventh rib,Condition,SNOMED,Disorder,S,1354746003,2025-01-01,2099-12-31,NA
1450050,Fracture of twelfth rib,Condition,SNOMED,Disorder,S,1354747007,2025-01-01,2099-12-31,NA
1450490,Fracture of left scapula,Condition,SNOMED,Disorder,S,46451000087100,2025-01-01,2099-12-31,NA
1450497,Fracture of right scapula,Condition,SNOMED,Disorder,S,46561000087103,2025-01-01,2099-12-31,NA
1450559,Fracture of left acetabulum,Condition,SNOMED,Disorder,S,47561000087101,2025-01-01,2099-12-31,NA
1450560,Fracture of right acetabulum,Condition,SNOMED,Disorder,S,47571000087105,2025-01-01,2099-12-31,NA
1450565,Fracture of left eighth rib,Condition,SNOMED,Disorder,S,47681000087108,2025-01-01,2099-12-31,NA
1450566,Fracture of left fifth rib,Condition,SNOMED,Disorder,S,47691000087105,2025-01-01,2099-12-31,NA
1450567,Fracture of left first rib,Condition,SNOMED,Disorder,S,47701000087105,2025-01-01,2099-12-31,NA
1450568,Fracture of left fourth rib,Condition,SNOMED,Disorder,S,47711000087107,2025-01-01,2099-12-31,NA
1450569,Fracture of left ninth rib,Condition,SNOMED,Disorder,S,47721000087104,2025-01-01,2099-12-31,NA
1450570,Fracture of left second rib,Condition,SNOMED,Disorder,S,47731000087102,2025-01-01,2099-12-31,NA
1450571,Fracture of left seventh rib,Condition,SNOMED,Disorder,S,47741000087108,2025-01-01,2099-12-31,NA
1450572,Fracture of left sixth rib,Condition,SNOMED,Disorder,S,47751000087106,2025-01-01,2099-12-31,NA
1450573,Fracture of left third rib,Condition,SNOMED,Disorder,S,47761000087109,2025-01-01,2099-12-31,NA
1450574,Fracture of right eighth rib,Condition,SNOMED,Disorder,S,47771000087100,2025-01-01,2099-12-31,NA
1450575,Fracture of right fifth rib,Condition,SNOMED,Disorder,S,47781000087103,2025-01-01,2099-12-31,NA
1450576,Fracture of right first rib,Condition,SNOMED,Disorder,S,47791000087101,2025-01-01,2099-12-31,NA
1450577,Fracture of right fourth rib,Condition,SNOMED,Disorder,S,47801000087102,2025-01-01,2099-12-31,NA
1450578,Fracture of right ninth rib,Condition,SNOMED,Disorder,S,47811000087100,2025-01-01,2099-12-31,NA
1450579,Fracture of right second rib,Condition,SNOMED,Disorder,S,47821000087108,2025-01-01,2099-12-31,NA
1450580,Fracture of right seventh rib,Condition,SNOMED,Disorder,S,47831000087105,2025-01-01,2099-12-31,NA
1450581,Fracture of right sixth rib,Condition,SNOMED,Disorder,S,47841000087104,2025-01-01,2099-12-31,NA
1450582,Fracture of right third rib,Condition,SNOMED,Disorder,S,47851000087101,2025-01-01,2099-12-31,NA
1450583,Fracture of right twelfth rib,Condition,SNOMED,Disorder,S,47861000087103,2025-01-01,2099-12-31,NA
1450584,Fracture of right tenth rib,Condition,SNOMED,Disorder,S,47871000087107,2025-01-01,2099-12-31,NA
1450585,Fracture of right eleventh rib,Condition,SNOMED,Disorder,S,47881000087109,2025-01-01,2099-12-31,NA
1450586,Fracture of left twelfth rib,Condition,SNOMED,Disorder,S,47891000087106,2025-01-01,2099-12-31,NA
1450587,Fracture of left tenth rib,Condition,SNOMED,Disorder,S,47901000087107,2025-01-01,2099-12-31,NA
1450588,Fracture of left eleventh rib,Condition,SNOMED,Disorder,S,47911000087109,2025-01-01,2099-12-31,NA
1450602,Fracture of coracoid process of left scapula,Condition,SNOMED,Disorder,S,48121000087104,2025-01-01,2099-12-31,NA
1450603,Fracture of coracoid process of right scapula,Condition,SNOMED,Disorder,S,48131000087102,2025-01-01,2099-12-31,NA
1450618,Fracture of multiple left ribs,Condition,SNOMED,Disorder,S,48301000087107,2025-01-01,2099-12-31,NA
1450619,Fracture of multiple right ribs,Condition,SNOMED,Disorder,S,48311000087109,2025-01-01,2099-12-31,NA
3169881,T1 to T3 fractures,Condition,Nebraska Lexicon,Clinical Finding,S,22090001000004105,2016-01-28,2099-12-31,NA
3179573,Fracture of anterior arch of first thoracic vertebra,Condition,Nebraska Lexicon,Clinical Finding,S,18910001000004106,2016-01-28,2099-12-31,NA
3656845,Multiple closed fractures of pelvis without disruption of pelvic circle,Condition,SNOMED,Disorder,S,328821000119104,2020-07-31,2099-12-31,NA
4008216,"Closed fracture thoracic vertebra, spondylolysis",Condition,SNOMED,Disorder,S,207941008,2002-01-31,2099-12-31,NA
4008217,"Closed fracture thoracic vertebra, transverse process",Condition,SNOMED,Disorder,S,207943006,2002-01-31,2099-12-31,NA
4008218,"Closed fracture thoracic vertebra, tricolumnar",Condition,SNOMED,Disorder,S,207945004,2002-01-31,2099-12-31,NA
4008220,"Closed fracture lumbar vertebra, wedge",Condition,SNOMED,Disorder,S,207959006,2002-01-31,2099-12-31,NA
4008221,"Closed fracture lumbar vertebra, spinous process",Condition,SNOMED,Disorder,S,207961002,2002-01-31,2099-12-31,NA
4008222,Open fracture lumbar vertebra,Condition,SNOMED,Disorder,S,207965006,2002-01-31,2099-12-31,NA
4008352,"Open fracture lumbar vertebra, burst",Condition,SNOMED,Disorder,S,207966007,2002-01-31,2099-12-31,NA
4008353,"Open fracture lumbar vertebra, spinous process",Condition,SNOMED,Disorder,S,207969000,2002-01-31,2099-12-31,NA
4008373,"Closed spinal fracture with posterior thoracic cord lesion, T1-6",Condition,SNOMED,Disorder,S,208031005,2002-01-31,2099-12-31,NA
4008374,"Closed spinal fracture with anterior thoracic cord lesion,T7-12",Condition,SNOMED,Disorder,S,208035001,2002-01-31,2099-12-31,NA
4008376,"Open spinal fracture with posterior thoracic cord lesion, T1-6",Condition,SNOMED,Disorder,S,208045004,2002-01-31,2099-12-31,NA
4008519,"Closed fracture acetabulum, anterior column",Condition,SNOMED,Disorder,S,208148000,2002-01-31,2099-12-31,NA
4008520,"Closed fracture acetabulum, posterior column",Condition,SNOMED,Disorder,S,208149008,2002-01-31,2099-12-31,NA
4008523,"Open fracture acetabulum, posterior column",Condition,SNOMED,Disorder,S,208158001,2002-01-31,2099-12-31,NA
4008524,Closed stable fracture of multiple pubic rami,Condition,SNOMED,Disorder,S,208166005,2002-01-31,2099-12-31,NA
4009296,Multiple fractures of thoracic spine,Condition,SNOMED,Disorder,S,208215006,2002-01-31,2099-12-31,NA
4009298,"Closed fracture scapula, spine",Condition,SNOMED,Disorder,S,208228004,2002-01-31,2099-12-31,NA
4009299,"Closed fracture scapula, neck",Condition,SNOMED,Disorder,S,208229007,2002-01-31,2099-12-31,NA
4009300,"Open fracture scapula, blade",Condition,SNOMED,Disorder,S,208234006,2002-01-31,2099-12-31,NA
4009908,"Open fracture thoracic vertebra, burst",Condition,SNOMED,Disorder,S,207950005,2002-01-31,2099-12-31,NA
4009909,"Open fracture thoracic vertebra, spondylolysis",Condition,SNOMED,Disorder,S,207952002,2002-01-31,2099-12-31,NA
4009910,"Open fracture thoracic vertebra, spinous process",Condition,SNOMED,Disorder,S,207953007,2002-01-31,2099-12-31,NA
4009911,"Closed fracture lumbar vertebra, transverse process",Condition,SNOMED,Disorder,S,207962009,2002-01-31,2099-12-31,NA
4009912,"Open fracture lumbar vertebra, wedge",Condition,SNOMED,Disorder,S,207967003,2002-01-31,2099-12-31,NA
4009913,"Open fracture lumbar vertebra, transverse process",Condition,SNOMED,Disorder,S,207970004,2002-01-31,2099-12-31,NA
4009914,"Open fracture lumbar vertebra, tricolumnar",Condition,SNOMED,Disorder,S,207972007,2002-01-31,2099-12-31,NA
4009915,Closed compression fracture sacrum,Condition,SNOMED,Disorder,S,207975009,2002-01-31,2099-12-31,NA
4009916,Closed vertical fracture of sacrum,Condition,SNOMED,Disorder,S,207976005,2002-01-31,2099-12-31,NA
4009917,Open compression fracture sacrum,Condition,SNOMED,Disorder,S,207978006,2002-01-31,2099-12-31,NA
4010065,"Closed spinal fracture with posterior thoracic cord lesion, T7-12",Condition,SNOMED,Disorder,S,208037009,2002-01-31,2099-12-31,NA
4010069,"Open spinal fracture with posterior thoracic cord lesion, T7-12",Condition,SNOMED,Disorder,S,208051009,2002-01-31,2099-12-31,NA
4010072,Open spinal fracture with posterior lumbar cord lesion,Condition,SNOMED,Disorder,S,208066007,2002-01-31,2099-12-31,NA
4010074,Closed fracture of sacrum with complete cauda equina lesion,Condition,SNOMED,Disorder,S,208071000,2002-01-31,2099-12-31,NA
4010220,Cough fracture of ribs,Condition,SNOMED,Disorder,S,208136003,2002-01-31,2099-12-31,NA
4010224,"Open fracture acetabulum, floor",Condition,SNOMED,Disorder,S,208159009,2002-01-31,2099-12-31,NA
4010228,"Closed fracture pelvis, anterior inferior iliac spine",Condition,SNOMED,Disorder,S,208183001,2002-01-31,2099-12-31,NA
4010231,"Open fracture pelvis, ischial tuberosity",Condition,SNOMED,Disorder,S,208192003,2002-01-31,2099-12-31,NA
4010232,"Open fracture pelvis, iliac wing",Condition,SNOMED,Disorder,S,208195001,2002-01-31,2099-12-31,NA
4010238,"Open fracture scapula, neck",Condition,SNOMED,Disorder,S,208236008,2002-01-31,2099-12-31,NA
4013033,Fracture of neck and trunk,Condition,SNOMED,Disorder,S,207884008,2002-01-31,2099-12-31,NA
4013155,"Closed fracture thoracic vertebra, burst",Condition,SNOMED,Disorder,S,207939007,2002-01-31,2099-12-31,NA
4013156,Open fracture thoracic vertebra,Condition,SNOMED,Disorder,S,207949005,2002-01-31,2099-12-31,NA
4013157,"Open fracture thoracic vertebra, transverse process",Condition,SNOMED,Disorder,S,207954001,2002-01-31,2099-12-31,NA
4013158,"Closed fracture lumbar vertebra, spondylolysis",Condition,SNOMED,Disorder,S,207960001,2002-01-31,2099-12-31,NA
4013159,"Closed fracture lumbar vertebra, posterior arch",Condition,SNOMED,Disorder,S,207963004,2002-01-31,2099-12-31,NA
4013160,Closed fracture sacrum,Condition,SNOMED,Disorder,S,207974008,2002-01-31,2099-12-31,NA
4013161,Open fracture sacrum,Condition,SNOMED,Disorder,S,207977001,2002-01-31,2099-12-31,NA
4013173,"Closed spinal fracture with complete thoracic cord lesion, T1-6",Condition,SNOMED,Disorder,S,208028009,2002-01-31,2099-12-31,NA
