concept_id,concept_name,domain_id,vocabulary_id,concept_class_id,standard_concept,concept_code,valid_start_date,valid_end_date,invalid_reason
313226,Carotid artery occlusion,Condition,SNOMED,Disorder,S,266254007,2002-01-31,2099-12-31,NA
314667,Nonpyogenic thrombosis of intracranial venous sinus,Condition,SNOMED,Disorder,S,42970005,2002-01-31,2099-12-31,NA
315116,Injury of carotid artery,Condition,SNOMED,Disorder,S,6956001,2002-01-31,2099-12-31,NA
316437,Cerebral atherosclerosis,Condition,SNOMED,Disorder,S,55382008,2002-01-31,2099-12-31,NA
316494,Cerebrovascular disorder in the puerperium,Condition,SNOMED,Disorder,S,6594005,2002-01-31,2099-12-31,NA
372721,Congenital anomaly of cerebrovascular system,Condition,SNOMED,Disorder,S,65587001,2002-01-31,2099-12-31,NA
372924,Cerebral artery occlusion,Condition,SNOMED,Disorder,S,20059004,2002-01-31,2099-12-31,NA
373503,Transient cerebral ischemia,Condition,SNOMED,Disorder,S,266257000,2002-01-31,2099-12-31,NA
374055,Basilar artery syndrome,Condition,SNOMED,Disorder,S,64009001,2002-01-31,2099-12-31,NA
374371,Stenosis of precerebral artery,Condition,SNOMED,Disorder,S,1055001,2002-01-31,2099-12-31,NA
374384,Cerebral ischemia,Condition,SNOMED,Disorder,S,287731003,2002-01-31,2099-12-31,NA
375557,Cerebral embolism,Condition,SNOMED,Disorder,S,75543006,2002-01-31,2099-12-31,NA
377254,"Multi-infarct dementia, uncomplicated",Condition,SNOMED,Disorder,S,70936005,2002-01-31,2099-12-31,NA
378774,Moyamoya disease,Condition,SNOMED,Disorder,S,69116000,2002-01-31,2099-12-31,NA
379778,Multi-infarct dementia,Condition,SNOMED,Disorder,S,56267009,2002-01-31,2099-12-31,NA
380423,Vertebral artery stenosis,Condition,SNOMED,Disorder,S,90520006,2002-01-31,2099-12-31,NA
380747,Cerebral arteritis,Condition,SNOMED,Disorder,S,28366008,2002-01-31,2099-12-31,NA
380943,Rupture of syphilitic cerebral aneurysm,Condition,SNOMED,Disorder,S,186893003,2002-01-31,2099-12-31,NA
381036,Multiple AND bilateral precerebral artery stenosis,Condition,SNOMED,Disorder,S,73192008,2002-01-31,2099-12-31,NA
381316,Cerebrovascular accident,Condition,SNOMED,Disorder,S,230690007,2002-01-31,2099-12-31,NA
381591,Cerebrovascular disease,Condition,SNOMED,Disorder,S,62914000,2002-01-31,2099-12-31,NA
432346,Dissection of vertebral artery,Condition,SNOMED,Disorder,S,230730001,2002-01-31,2099-12-31,NA
434656,Vertebral artery syndrome,Condition,SNOMED,Disorder,S,34781003,2002-01-31,2099-12-31,NA
436277,Injury of common carotid artery,Condition,SNOMED,Disorder,S,19474002,2002-01-31,2099-12-31,NA
436392,Carotid sinus syncope,Condition,SNOMED,Disorder,S,51723007,2002-01-31,2099-12-31,NA
437308,Basilar artery occlusion,Condition,SNOMED,Disorder,S,195180004,2002-01-31,2099-12-31,NA
437427,Injury of external carotid artery,Condition,SNOMED,Disorder,S,6715005,2002-01-31,2099-12-31,NA
437540,Central retinal artery occlusion,Condition,SNOMED,Disorder,S,38742007,2002-01-31,2099-12-31,NA
439190,Injury of internal carotid artery,Condition,SNOMED,Disorder,S,80820004,2002-01-31,2099-12-31,NA
439295,Multiple and bilateral precerebral arterial occlusion,Condition,SNOMED,Disorder,S,195183002,2002-01-31,2099-12-31,NA
439296,Vertebral artery occlusion,Condition,SNOMED,Disorder,S,195182007,2002-01-31,2099-12-31,NA
441246,Hemangioma of intracranial structure,Condition,SNOMED,Disorder,S,93468003,2002-01-31,2099-12-31,NA
441874,Cerebral thrombosis,Condition,SNOMED,Disorder,S,71444005,2002-01-31,2099-12-31,NA
442263,Basilar artery stenosis,Condition,SNOMED,Disorder,S,54519002,2002-01-31,2099-12-31,NA
442615,Carotid artery stenosis,Condition,SNOMED,Disorder,S,64586002,2002-01-31,2099-12-31,NA
443239,Precerebral arterial occlusion,Condition,SNOMED,Disorder,S,266253001,2002-01-31,2099-12-31,NA
443790,Multi-infarct dementia with delusions,Condition,SNOMED,Disorder,S,25772007,2002-01-31,2099-12-31,NA
443864,Multi-infarct dementia with depression,Condition,SNOMED,Disorder,S,14070001,2002-01-31,2099-12-31,NA
444091,Multi-infarct dementia with delirium,Condition,SNOMED,Disorder,S,10349009,2002-01-31,2099-12-31,NA
600670,Occlusion of anterior cerebral artery,Condition,SNOMED,Disorder,S,1153543002,2021-07-31,2099-12-31,NA
601068,Bilateral occlusion of middle cerebral arteries,Condition,SNOMED,Disorder,S,329501000119102,2021-01-31,2099-12-31,NA
601069,Bilateral occlusion of anterior cerebral arteries,Condition,SNOMED,Disorder,S,329541000119100,2021-01-31,2099-12-31,NA
602584,Cerebrovascular accident due to occlusion of basilar artery,Condition,SNOMED,Disorder,S,239965291000119107,2021-07-31,2099-12-31,NA
602590,Cerebrovascular accident of basal ganglia,Condition,SNOMED,Disorder,S,595899961000119100,2021-01-31,2099-12-31,NA
602613,Cerebrovascular accident due to embolism of bilateral cerebellar arteries,Condition,SNOMED,Disorder,S,58173271000119101,2021-07-31,2099-12-31,NA
602615,Cerebrovascular accident due to occlusion of right anterior cerebral artery,Condition,SNOMED,Disorder,S,655081461000119101,2021-07-31,2099-12-31,NA
602658,Thrombosis of cerebral venous sinus due to and following surgical procedure,Condition,SNOMED,Disorder,S,1078223005,2021-01-31,2099-12-31,NA
603206,Cerebrovascular accident due to occlusion of left posterior communicating artery,Condition,SNOMED,Disorder,S,117776611000119102,2021-07-31,2099-12-31,NA
603326,Cryptogenic stroke,Condition,SNOMED,Disorder,S,16891111000119104,2021-01-31,2099-12-31,NA
604171,Cerebrovascular accident due to thrombosis of right cerebellar artery,Condition,SNOMED,Disorder,S,496369931000119104,2021-07-31,2099-12-31,NA
604192,Cerebrovascular accident of thalamus,Condition,SNOMED,Disorder,S,769023031000119104,2021-07-31,2099-12-31,NA
605421,Cerebrovascular accident due to embolism of bilateral anterior cerebral arteries,Condition,SNOMED,Disorder,S,107557061000119108,2021-07-31,2099-12-31,NA
606048,Neonatal ischemic stroke,Condition,SNOMED,Disorder,S,1142056004,2021-07-31,2099-12-31,NA
607524,Occlusion of right anterior cerebral artery,Condition,SNOMED,Disorder,S,1153544008,2021-07-31,2099-12-31,NA
607525,Occlusion of left anterior cerebral artery,Condition,SNOMED,Disorder,S,1153545009,2021-07-31,2099-12-31,NA
607526,Bilateral occlusion of posterior cerebral arteries,Condition,SNOMED,Disorder,S,1153546005,2021-07-31,2099-12-31,NA
607564,Occlusion of right posterior communicating artery,Condition,SNOMED,Disorder,S,1153607003,2021-07-31,2099-12-31,NA
607565,Occlusion of left posterior communicating artery,Condition,SNOMED,Disorder,S,1153608008,2021-07-31,2099-12-31,NA
607568,Embolism of left anterior cerebral artery,Condition,SNOMED,Disorder,S,1153611009,2021-07-31,2099-12-31,NA
607569,Embolism of right anterior cerebral artery,Condition,SNOMED,Disorder,S,1153612002,2021-07-31,2099-12-31,NA
607583,Embolism of left carotid artery,Condition,SNOMED,Disorder,S,1153630009,2021-07-31,2099-12-31,NA
607584,Embolism of right carotid artery,Condition,SNOMED,Disorder,S,1153631008,2021-07-31,2099-12-31,NA
607585,Bilateral embolism of middle cerebral arteries,Condition,SNOMED,Disorder,S,1153632001,2021-07-31,2099-12-31,NA
607586,Bilateral embolism of posterior cerebral arteries,Condition,SNOMED,Disorder,S,1153633006,2021-07-31,2099-12-31,NA
607587,Bilateral embolism of anterior cerebral arteries,Condition,SNOMED,Disorder,S,1153634000,2021-07-31,2099-12-31,NA
607591,Occlusion of bilateral cerebellar arteries,Condition,SNOMED,Disorder,S,1153638002,2021-07-31,2099-12-31,NA
607611,Bilateral embolism of carotid arteries,Condition,SNOMED,Disorder,S,1155688007,2021-07-31,2099-12-31,NA
607612,Bilateral embolism of cerebellar arteries,Condition,SNOMED,Disorder,S,1155689004,2021-07-31,2099-12-31,NA
607619,Embolism of left vertebral artery,Condition,SNOMED,Disorder,S,1155697006,2021-07-31,2099-12-31,NA
607620,Embolism of right vertebral artery,Condition,SNOMED,Disorder,S,1155698001,2021-07-31,2099-12-31,NA
607621,Bilateral embolism of vertebral arteries,Condition,SNOMED,Disorder,S,1155699009,2021-07-31,2099-12-31,NA
607815,Left posterior cerebral artery thrombosis,Condition,SNOMED,Disorder,S,1156016006,2021-07-31,2099-12-31,NA
607816,Right posterior cerebral artery thrombosis,Condition,SNOMED,Disorder,S,1156017002,2021-07-31,2099-12-31,NA
607817,Left cerebellar artery thrombosis,Condition,SNOMED,Disorder,S,1156018007,2021-07-31,2099-12-31,NA
607818,Right cerebellar artery thrombosis,Condition,SNOMED,Disorder,S,1156019004,2021-07-31,2099-12-31,NA
607826,Cerebral venous sinus thrombosis in pregnancy,Condition,SNOMED,Disorder,S,1156027008,2021-07-31,2099-12-31,NA
607828,Cerebral venous sinus thrombosis in puerperium,Condition,SNOMED,Disorder,S,1156029006,2021-07-31,2099-12-31,NA
608422,Right carotid artery injury,Condition,SNOMED,Disorder,S,11842891000119102,2021-07-31,2099-12-31,NA
608423,Left carotid artery injury,Condition,SNOMED,Disorder,S,11842931000119105,2021-07-31,2099-12-31,NA
608424,Right vertebral artery injury,Condition,SNOMED,Disorder,S,11844791000119100,2021-07-31,2099-12-31,NA
608425,Left vertebral artery injury,Condition,SNOMED,Disorder,S,11844831000119106,2021-07-31,2099-12-31,NA
608742,Cerebrovascular accident due to embolism of bilateral carotid arteries,Condition,SNOMED,Disorder,S,152148641000119104,2021-07-31,2099-12-31,NA
609074,Congenital fenestration of basilar artery,Condition,SNOMED,Disorder,S,16520041000119104,2021-01-31,2099-12-31,NA
609082,Congenital duplication of anterior communicating artery,Condition,SNOMED,Disorder,S,16528221000119104,2021-01-31,2099-12-31,NA
609188,Cerebrovascular accident due to embolism of bilateral posterior cerebral arteries,Condition,SNOMED,Disorder,S,168747591000119109,2021-07-31,2099-12-31,NA
609242,Cerebrovascular accident due to occlusion of left anterior cerebral artery,Condition,SNOMED,Disorder,S,182960891000119101,2021-07-31,2099-12-31,NA
609245,Cerebrovascular accident due to occlusion of bilateral middle cerebral arteries,Condition,SNOMED,Disorder,S,188174841000119103,2021-07-31,2099-12-31,NA
609263,Cerebrovascular accident due to embolism of left anterior cerebral artery,Condition,SNOMED,Disorder,S,251770561000119107,2021-07-31,2099-12-31,NA
609301,Cerebrovascular accident due to occlusion of bilateral cerebellar arteries,Condition,SNOMED,Disorder,S,346674811000119104,2021-07-31,2099-12-31,NA
609313,Cerebrovascular accident due to embolism of right carotid artery,Condition,SNOMED,Disorder,S,384430101000119103,2021-07-31,2099-12-31,NA
609314,Cerebrovascular accident due to thrombosis of right posterior cerebral artery,Condition,SNOMED,Disorder,S,38595071000119104,2021-07-31,2099-12-31,NA
618627,Cerebrovascular accident due to thrombosis of right vertebral artery,Condition,SNOMED,Disorder,S,511452481000119102,2021-07-31,2099-12-31,NA
618628,Cerebrovascular accident due to embolism of left vertebral artery,Condition,SNOMED,Disorder,S,517253051000119105,2021-07-31,2099-12-31,NA
618640,Cerebrovascular accident of brainstem,Condition,SNOMED,Disorder,S,652287331000119104,2021-01-31,2099-12-31,NA
618658,Cerebrovascular accident due to occlusion of bilateral anterior cerebral arteries,Condition,SNOMED,Disorder,S,720261501000119107,2021-07-31,2099-12-31,NA
618670,Cerebrovascular accident due to embolism of bilateral vertebral arteries,Condition,SNOMED,Disorder,S,732330391000119107,2021-07-31,2099-12-31,NA
618672,Cerebrovascular accident due to thrombosis of left vertebral artery,Condition,SNOMED,Disorder,S,759950981000119101,2021-07-31,2099-12-31,NA
618677,Cerebrovascular accident due to embolism of right vertebral artery,Condition,SNOMED,Disorder,S,806161651000119106,2021-07-31,2099-12-31,NA
618684,Cerebrovascular accident due to embolism of right anterior cerebral artery,Condition,SNOMED,Disorder,S,849488701000119104,2021-07-31,2099-12-31,NA
618685,Cerebrovascular accident due to occlusion of right posterior communicating artery,Condition,SNOMED,Disorder,S,849579281000119106,2021-07-31,2099-12-31,NA
618686,Cerebrovascular accident due to thrombosis of left posterior cerebral artery,Condition,SNOMED,Disorder,S,851365731000119106,2021-07-31,2099-12-31,NA
618688,Cerebrovascular accident due to embolism of left carotid artery,Condition,SNOMED,Disorder,S,859422751000119101,2021-07-31,2099-12-31,NA
618689,Cerebrovascular accident due to occlusion of bilateral posterior cerebral arteries,Condition,SNOMED,Disorder,S,86553761000119103,2021-07-31,2099-12-31,NA
619046,Cerebrovascular accident of medulla oblongata,Condition,SNOMED,Disorder,S,881694631000119107,2021-01-31,2099-12-31,NA
619802,Cerebrovascular accident due to occlusion of bilateral vertebral arteries,Condition,SNOMED,Disorder,S,898941951000119108,2021-07-31,2099-12-31,NA
619830,Cerebrovascular accident due to embolism of basilar artery,Condition,SNOMED,Disorder,S,915141931000119109,2021-01-31,2099-12-31,NA
619933,Cerebrovascular accident due to embolism of bilateral middle cerebral arteries,Condition,SNOMED,Disorder,S,939885431000119109,2021-07-31,2099-12-31,NA
619944,Cerebrovascular accident due to thrombosis of left cerebellar artery,Condition,SNOMED,Disorder,S,957319791000119104,2021-07-31,2099-12-31,NA
760985,Stenosis of cavernous portion of right internal carotid artery,Condition,SNOMED,Disorder,S,12720001000004100,2015-09-01,2099-12-31,NA
761061,Nonatherosclerotic cerebrovascular accident,Condition,SNOMED,Disorder,S,140251000119101,2016-09-01,2099-12-31,NA
761410,Thrombosis of right internal carotid artery,Condition,SNOMED,Disorder,S,15707841000119101,2015-09-01,2099-12-31,NA
761411,Thrombosis of left internal carotid artery,Condition,SNOMED,Disorder,S,15707881000119106,2015-09-01,2099-12-31,NA
761412,Thrombosis of bilateral internal carotid arteries,Condition,SNOMED,Disorder,S,15707921000119104,2017-09-01,2099-12-31,NA
761786,Fibromuscular hyperplasia of left carotid artery,Condition,SNOMED,Disorder,S,16001671000119100,2017-09-01,2099-12-31,NA
761789,Cerebrovascular accident due to thrombus of right cerebellar artery,Condition,SNOMED,Disorder,S,16002071000119104,2017-09-01,2099-12-31,NA
761790,Nonpyogenic cerebral venous thrombosis with stroke,Condition,SNOMED,Disorder,S,16002151000119107,2018-03-01,2099-12-31,NA
761791,Left cerebellar artery thrombosis with stroke,Condition,SNOMED,Disorder,S,16002191000119102,2018-03-01,2099-12-31,NA
761794,Right vertebral artery embolism with stroke,Condition,SNOMED,Disorder,S,16002351000119105,2018-03-01,2099-12-31,NA
761795,Left vertebral artery embolism with stroke,Condition,SNOMED,Disorder,S,16002391000119100,2018-03-01,2099-12-31,NA
761798,Basilar artery embolism with stroke,Condition,SNOMED,Disorder,S,16002511000119104,2018-03-01,2099-12-31,NA
761930,Asymptomatic carotid artery stenosis,Condition,SNOMED,Disorder,S,21000119103,2012-09-01,2099-12-31,NA
761994,Stenosis of intracranial vessel,Condition,SNOMED,Disorder,S,27820001000004104,2015-09-01,2099-12-31,NA
762095,Spontaneous hemorrhage of subarachnoid space from left middle cerebral artery,Condition,SNOMED,Disorder,S,291401000119102,2017-09-01,2099-12-31,NA
762096,Non-traumatic hemorrhage of subarachnoid space from right middle cerebral artery,Condition,SNOMED,Disorder,S,291471000119107,2018-03-01,2099-12-31,NA
762339,Right anterior cerebral artery embolism with stroke,Condition,SNOMED,Disorder,S,329391000119100,2018-03-01,2099-12-31,NA
762340,Left anterior cerebral artery embolism with stroke,Condition,SNOMED,Disorder,S,329401000119103,2018-03-01,2099-12-31,NA
762344,Cerebrovascular accident due to thrombus of right vertebral artery,Condition,SNOMED,Disorder,S,329621000119105,2017-09-01,2099-12-31,NA
762345,Left vertebral artery thrombosis with stroke,Condition,SNOMED,Disorder,S,329631000119108,2018-03-01,2099-12-31,NA
762351,Ruptured acquired aneurysm of cerebral artery,Condition,SNOMED,Disorder,S,330111000119103,2017-09-01,2099-12-31,NA
762583,Dissecting aneurysm of middle cerebral artery,Condition,SNOMED,Disorder,S,429231000124101,2012-09-01,2099-12-31,NA
762584,Dissecting aneurysm of posterior cerebral artery,Condition,SNOMED,Disorder,S,429241000124106,2012-09-01,2099-12-31,NA
762585,Dissecting aneurysm of anterior cerebral artery,Condition,SNOMED,Disorder,S,429251000124108,2012-09-01,2099-12-31,NA
762627,Anterior cerebral artery embolism,Condition,SNOMED,Disorder,S,429811000124106,2012-09-01,2099-12-31,NA
762628,Posterior cerebral artery embolism,Condition,SNOMED,Disorder,S,429821000124103,2012-09-01,2099-12-31,NA
762629,Cerebellar artery embolism,Condition,SNOMED,Disorder,S,429831000124100,2012-09-01,2099-12-31,NA
762630,Anterior inferior cerebellar artery embolism,Condition,SNOMED,Disorder,S,429851000124107,2012-09-01,2099-12-31,NA
762631,Posterior inferior cerebellar artery embolism,Condition,SNOMED,Disorder,S,429861000124109,2012-09-01,2099-12-31,NA
762700,Carotid artery occlusion without infarction,Condition,SNOMED,Disorder,S,430721000124101,2012-09-01,2099-12-31,NA
762701,Basilar artery occlusion without infarction,Condition,SNOMED,Disorder,S,430731000124103,2012-09-01,2099-12-31,NA
762707,Occlusion and stenosis of posterior cerebral artery without infarction,Condition,SNOMED,Disorder,S,430831000124106,2012-09-01,2099-12-31,NA
762708,Multiple and bilateral precerebral artery stenosis with infarction,Condition,SNOMED,Disorder,S,430851000124104,2012-09-01,2099-12-31,NA
762755,Arteriosclerosis of carotid artery,Condition,SNOMED,Disorder,S,431421000124103,2012-09-01,2099-12-31,NA
762811,Cerebral venous thrombosis of cortical vein without infarction,Condition,SNOMED,Disorder,S,432261000124102,2012-09-01,2099-12-31,NA
762828,Thrombosis of cerebral medullary veins,Condition,SNOMED,Disorder,S,432481000124106,2012-09-01,2099-12-31,NA
762926,Occlusion of internal carotid artery,Condition,SNOMED,Disorder,S,433821000124102,2013-03-01,2099-12-31,NA
762936,Occlusion and stenosis of posterior cerebral artery with infarction,Condition,SNOMED,Disorder,S,433951000124102,2013-03-01,2099-12-31,NA
762938,Cerebral venous thrombosis of cortical vein with infarction,Condition,SNOMED,Disorder,S,433971000124107,2013-03-01,2099-12-31,NA
762954,Post-radiotherapy cerebral vasculopathy,Condition,SNOMED,Disorder,S,434191000124107,2013-03-01,2099-12-31,NA
763003,Vertebral artery occlusion with infarction,Condition,SNOMED,Disorder,S,434821000124104,2013-09-01,2099-12-31,NA
763004,Vertebral artery stenosis with infarction,Condition,SNOMED,Disorder,S,434831000124101,2013-09-01,2099-12-31,NA
763009,Multiple and bilateral precerebral arterial occlusion with infarction,Condition,SNOMED,Disorder,S,434881000124100,2013-09-01,2099-12-31,NA
763014,Middle cerebral artery occlusion,Condition,SNOMED,Disorder,S,434951000124104,2013-09-01,2099-12-31,NA
763035,Vertebral artery occlusion without infarction,Condition,SNOMED,Disorder,S,435271000124103,2013-09-01,2099-12-31,NA
763093,Carotid artery stenosis without infarction,Condition,SNOMED,Disorder,S,436021000124100,2013-09-01,2099-12-31,NA
763094,Anterior inferior cerebellar artery occlusion with infarction,Condition,SNOMED,Disorder,S,436031000124102,2013-09-01,2099-12-31,NA
763095,Posterior inferior cerebellar artery occlusion with infarction,Condition,SNOMED,Disorder,S,436041000124107,2013-09-01,2099-12-31,NA
763149,Thrombophlebitis of superior anastomotic vein,Condition,SNOMED,Disorder,S,436591000124109,2013-09-01,2099-12-31,NA
763168,Intracranial artery occlusion with infarction,Condition,SNOMED,Disorder,S,436781000124104,2013-09-01,2099-12-31,NA
763267,Recurrent artery of Huebner occlusion with infarction,Condition,SNOMED,Disorder,S,437911000124106,2013-09-01,2099-12-31,NA
764362,Occlusion of superior cerebellar artery,Condition,SNOMED,Disorder,S,454031000124106,2017-09-01,2099-12-31,NA
764496,Occlusive embolus of left vertebral artery,Condition,SNOMED,Disorder,S,455791000124106,2018-03-01,2099-12-31,NA
764497,Occlusive embolus of right vertebral artery,Condition,SNOMED,Disorder,S,455801000124107,2018-03-01,2099-12-31,NA
764498,Occlusive embolus of basilar artery,Condition,SNOMED,Disorder,S,455811000124105,2018-03-01,2099-12-31,NA
764499,Occlusive embolus of left carotid artery,Condition,SNOMED,Disorder,S,455821000124102,2018-03-01,2099-12-31,NA
764500,Occlusive embolus of right carotid artery,Condition,SNOMED,Disorder,S,455831000124104,2018-03-01,2099-12-31,NA
764501,Occlusive embolus of left anterior cerebral,Condition,SNOMED,Disorder,S,455841000124109,2018-03-01,2099-12-31,NA
764502,Occlusive embolus of right anterior cerebral,Condition,SNOMED,Disorder,S,455851000124106,2018-03-01,2099-12-31,NA
764503,Occlusion of cerebral vein by nonpyogenic thrombus,Condition,SNOMED,Disorder,S,455901000124101,2018-03-01,2099-12-31,NA
764504,Occlusive thrombus of left cerebellar artery,Condition,SNOMED,Disorder,S,455911000124103,2018-03-01,2099-12-31,NA
764505,Occlusive thrombus of left vertebral artery,Condition,SNOMED,Disorder,S,455921000124106,2018-03-01,2099-12-31,NA
764506,Occlusive thrombus of left posterior cerebral artery,Condition,SNOMED,Disorder,S,455931000124109,2018-03-01,2099-12-31,NA
764703,Thrombosis of superior cerebellar artery,Condition,SNOMED,Disorder,S,5451000124107,2012-03-01,2099-12-31,NA
764705,Thrombosis of anterior inferior cerebellar artery,Condition,SNOMED,Disorder,S,5461000124109,2012-03-01,2099-12-31,NA
764707,Ruptured aneurysm of intracranial artery,Condition,SNOMED,Disorder,S,5471000124102,2012-03-01,2099-12-31,NA
764708,Thrombophlebitis of straight sinus,Condition,SNOMED,Disorder,S,5481000124104,2012-03-01,2099-12-31,NA
764712,Thrombophlebitis of internal cerebral vein,Condition,SNOMED,Disorder,S,5501000124109,2012-03-01,2099-12-31,NA
764714,Thrombophlebitis of sigmoid sinus,Condition,SNOMED,Disorder,S,5511000124107,2012-03-01,2099-12-31,NA
764716,Thrombophlebitis of basal vein of Rosenthal,Condition,SNOMED,Disorder,S,5531000124101,2012-03-01,2099-12-31,NA
764721,Cerebrovascular accident with intracranial hemorrhage,Condition,SNOMED,Disorder,S,5571000124103,2012-03-01,2099-12-31,NA
764722,Thrombosis of posterior cerebral artery,Condition,SNOMED,Disorder,S,5581000124100,2012-03-01,2099-12-31,NA
764723,Thrombosis of superior anastomotic vein,Condition,SNOMED,Disorder,S,5591000124102,2012-03-01,2099-12-31,NA
764725,Thrombosis of posterior inferior cerebellar artery,Condition,SNOMED,Disorder,S,5601000124105,2012-03-01,2099-12-31,NA
764726,Thrombosis of basal vein,Condition,SNOMED,Disorder,S,5611000124108,2012-03-01,2099-12-31,NA
764734,Pseudoaneurysm of vertebral artery,Condition,SNOMED,Disorder,S,5651000124109,2012-03-01,2099-12-31,NA
765282,Fibromuscular hyperplasia of right carotid artery,Condition,SNOMED,Disorder,S,16001711000119101,2017-09-01,2099-12-31,NA
765404,Stenosis of middle cerebral artery,Condition,SNOMED,Disorder,S,21290001000004104,2015-09-01,2099-12-31,NA
765488,Superior cerebellar artery embolism,Condition,SNOMED,Disorder,S,429841000124105,2012-09-01,2099-12-31,NA
765495,Occlusion and stenosis of middle cerebral artery without infarction,Condition,SNOMED,Disorder,S,430781000124102,2012-09-01,2099-12-31,NA
765568,Chronic cerebrovascular accident,Condition,SNOMED,Disorder,S,434141000124103,2013-03-01,2099-12-31,NA
765606,Internal carotid artery stenosis with infarction,Condition,SNOMED,Disorder,S,434891000124102,2013-09-01,2099-12-31,NA
765609,Vertebral artery stenosis without infarction,Condition,SNOMED,Disorder,S,435281000124100,2013-09-01,2099-12-31,NA
765664,Anterior choroidal artery occlusion with infarction,Condition,SNOMED,Disorder,S,436791000124101,2013-09-01,2099-12-31,NA
765774,Occlusion and stenosis of anterior cerebral artery without infarction,Condition,SNOMED,Disorder,S,430841000124101,2012-09-01,2099-12-31,NA
765775,Multiple and bilateral precerebral artery stenosis without infarction,Condition,SNOMED,Disorder,S,430861000124102,2012-09-01,2099-12-31,NA
765907,Occlusion and stenosis of middle cerebral artery with infarction,Condition,SNOMED,Disorder,S,433941000124104,2013-03-01,2099-12-31,NA
1075000,Complete transection of right carotid artery,Condition,SNOMED,Disorder,S,11842811000119106,2024-03-01,2099-12-31,NA
1075001,Complete transection of left carotid artery,Condition,SNOMED,Disorder,S,11842851000119107,2024-03-01,2099-12-31,NA
1075002,Right carotid artery laceration,Condition,SNOMED,Disorder,S,11842971000119108,2024-03-01,2099-12-31,NA
1075003,Left carotid artery laceration,Condition,SNOMED,Disorder,S,11843011000119108,2024-03-01,2099-12-31,NA
1075008,Traumatic right carotid cavernous fistula,Condition,SNOMED,Disorder,S,11845111000119106,2024-05-01,2099-12-31,NA
1075009,Traumatic left carotid cavernous fistula,Condition,SNOMED,Disorder,S,11845151000119107,2024-05-01,2099-12-31,NA
1075218,Laceration of carotid artery,Condition,SNOMED,Disorder,S,1303162002,2024-03-01,2099-12-31,NA
1075234,Complete transection of carotid artery,Condition,SNOMED,Disorder,S,1303209003,2024-03-01,2099-12-31,NA
1075786,Traumatic carotid cavernous fistula,Condition,SNOMED,Disorder,S,1332106007,2024-05-01,2099-12-31,NA
1075864,Thrombosis of bilateral anterior cerebral arteries,Condition,SNOMED,Disorder,S,1332386004,2024-05-01,2099-12-31,NA
1076484,Iatrogenic ischemic cerebral infarction,Condition,SNOMED,Disorder,S,1344635001,2024-08-01,2099-12-31,NA
1077437,Cerebrovascular accident due to thrombosis of bilateral anterior cerebral arteries,Condition,SNOMED,Disorder,S,721711931000119105,2024-05-01,2099-12-31,NA
1244503,Bilateral posterior communicating artery occlusion,Condition,SNOMED,Disorder,S,1287890000,2024-02-01,2099-12-31,NA
1244908,Aneurysm of intracranial artery,Condition,SNOMED,Disorder,S,1293173007,2023-11-01,2099-12-31,NA
1244909,Aneurysm of intracranial vein,Condition,SNOMED,Disorder,S,1293174001,2023-11-01,2099-12-31,NA
1245872,Cerebrovascular accident due to occlusion of bilateral posterior communicating arteries,Condition,SNOMED,Disorder,S,16644981000119109,2024-02-01,2099-12-31,NA
1340274,Exacerbation of cerebrovascular accident,Condition,OMOP Extension,Disorder,S,OMOP5165929,2022-05-06,2099-12-31,NA
1448761,Cerebrovascular accident during operation on heart,Condition,SNOMED,Disorder,S,12067951000119107,2025-01-01,2099-12-31,NA
