concept_id,concept_name,domain_id,vocabulary_id,concept_class_id,standard_concept,concept_code,valid_start_date,valid_end_date,invalid_reason
72405,Osteoarthritis of shoulder region,Condition,SNOMED,Disorder,S,67315001,2002-01-31,2099-12-31,NA
73840,"Localized, primary osteoarthritis of the shoulder region",Condition,SNOMED,Disorder,S,201831003,2002-01-31,2099-12-31,NA
74722,Secondary localized osteoarthrosis of pelvic region,Condition,SNOMED,Disorder,S,25343008,2002-01-31,2099-12-31,NA
75036,"Localized, primary osteoarthritis of the hand",Condition,SNOMED,Disorder,S,201834006,2002-01-31,2099-12-31,NA
75617,Generalized osteoarthritis,Condition,SNOMED,Disorder,S,201819000,2002-01-31,2099-12-31,NA
76194,Osteoarthrosis involving multiple sites but not designated as generalized,Condition,SNOMED,Disorder,S,33262002,2002-01-31,2099-12-31,NA
77631,"Localized, secondary osteoarthritis of the shoulder region",Condition,SNOMED,Disorder,S,201849003,2002-01-31,2099-12-31,NA
78227,Osteoarthritis of joint of hand,Condition,SNOMED,Disorder,S,22193007,2002-01-31,2099-12-31,NA
79904,"Localized, secondary osteoarthritis of the hand",Condition,SNOMED,Disorder,S,201852006,2002-01-31,2099-12-31,NA
80180,Osteoarthritis,Condition,SNOMED,Disorder,S,396275006,2003-07-31,2099-12-31,NA
80183,"Localized, secondary osteoarthritis of the ankle and/or foot",Condition,SNOMED,Disorder,S,201855008,2002-01-31,2099-12-31,NA
80802,"Localized, secondary osteoarthritis",Condition,SNOMED,Disorder,S,201847001,2002-01-31,2099-12-31,NA
759878,Osteoarthritis of right acromioclavicular joint,Condition,SNOMED,Disorder,S,1074371000119104,2015-09-01,2099-12-31,NA
759881,Osteoarthritis of left acromioclavicular joint,Condition,SNOMED,Disorder,S,1074431000119108,2015-09-01,2099-12-31,NA
760900,Osteoarthritis of finger joint of left hand,Condition,SNOMED,Disorder,S,12241631000119102,2015-09-01,2099-12-31,NA
760901,Osteoarthritis of finger joint of right hand,Condition,SNOMED,Disorder,S,12241671000119104,2015-09-01,2099-12-31,NA
1076569,Bilateral subtalar osteoarthritis,Condition,SNOMED,Disorder,S,15722481000119101,2024-06-01,2099-12-31,NA
1244122,Secondary osteoarthritis of hip,Condition,SNOMED,Disorder,S,1071171000119104,2023-10-01,2099-12-31,NA
1244139,Secondary osteoarthritis of left hip,Condition,SNOMED,Disorder,S,1074321000119100,2023-10-01,2099-12-31,NA
1244140,Secondary osteoarthritis of right hip,Condition,SNOMED,Disorder,S,1074331000119102,2023-10-01,2099-12-31,NA
1244141,Secondary osteoarthritis of bilateral knees,Condition,SNOMED,Disorder,S,1074341000119106,2023-10-01,2099-12-31,NA
1244142,Secondary osteoarthritis of left knee,Condition,SNOMED,Disorder,S,1074351000119108,2023-10-01,2099-12-31,NA
1244143,Secondary osteoarthritis of right knee,Condition,SNOMED,Disorder,S,1074361000119105,2023-10-01,2099-12-31,NA
1244144,Secondary osteoarthritis of right foot,Condition,SNOMED,Disorder,S,1074541000119103,2023-10-01,2099-12-31,NA
1244145,Secondary osteoarthritis of left foot,Condition,SNOMED,Disorder,S,1074551000119101,2023-10-01,2099-12-31,NA
1244521,Secondary osteoarthritis of joint of wrist,Condition,SNOMED,Disorder,S,1288014009,2023-10-01,2099-12-31,NA
1244522,Secondary osteoarthritis of joint of hand,Condition,SNOMED,Disorder,S,1288016006,2023-10-01,2099-12-31,NA
1244524,Secondary osteoarthritis of joint of foot,Condition,SNOMED,Disorder,S,1288018007,2023-10-01,2099-12-31,NA
1244606,Secondary osteoarthritis of glenohumeral joint,Condition,SNOMED,Disorder,S,1290147003,2023-10-01,2099-12-31,NA
1245608,Secondary osteoarthritis of bilateral ankles,Condition,SNOMED,Disorder,S,15723001000119109,2023-10-01,2099-12-31,NA
1245609,Secondary osteoarthritis of bilateral feet,Condition,SNOMED,Disorder,S,15723041000119106,2023-10-01,2099-12-31,NA
1245610,Secondary osteoarthritis of bilateral hands,Condition,SNOMED,Disorder,S,15723081000119101,2023-10-01,2099-12-31,NA
1245611,Secondary osteoarthritis of bilateral hips,Condition,SNOMED,Disorder,S,15723121000119104,2023-10-01,2099-12-31,NA
1245612,Secondary osteoarthritis of bilateral elbows,Condition,SNOMED,Disorder,S,15723161000119109,2023-10-01,2099-12-31,NA
1245613,Secondary osteoarthritis of bilateral glenohumeral joints,Condition,SNOMED,Disorder,S,15723201000119104,2023-10-01,2099-12-31,NA
1245614,Secondary osteoarthritis of bilateral wrists,Condition,SNOMED,Disorder,S,15723241000119102,2023-10-01,2099-12-31,NA
1245868,Secondary osteoarthritis of left ankle,Condition,SNOMED,Disorder,S,16583201000119109,2023-10-01,2099-12-31,NA
1245869,Secondary osteoarthritis of right ankle,Condition,SNOMED,Disorder,S,16583241000119106,2023-10-01,2099-12-31,NA
1246189,Secondary osteoarthritis of elbow,Condition,SNOMED,Disorder,S,320311000119102,2023-10-01,2099-12-31,NA
1246190,Secondary osteoarthritis of left elbow,Condition,SNOMED,Disorder,S,320331000119107,2023-10-01,2099-12-31,NA
1246191,Secondary osteoarthritis of left hand,Condition,SNOMED,Disorder,S,320341000119103,2023-10-01,2099-12-31,NA
1246192,Secondary osteoarthritis of left glenohumeral joint,Condition,SNOMED,Disorder,S,320351000119101,2023-10-01,2099-12-31,NA
1246193,Secondary osteoarthritis of left wrist,Condition,SNOMED,Disorder,S,320361000119104,2023-10-01,2099-12-31,NA
1246194,Secondary osteoarthritis of right elbow,Condition,SNOMED,Disorder,S,320381000119108,2023-10-01,2099-12-31,NA
1246195,Secondary osteoarthritis of right hand,Condition,SNOMED,Disorder,S,320391000119106,2023-10-01,2099-12-31,NA
1246196,Secondary osteoarthritis of right glenohumeral joint,Condition,SNOMED,Disorder,S,320401000119108,2023-10-01,2099-12-31,NA
1246197,Secondary osteoarthritis of right wrist,Condition,SNOMED,Disorder,S,320411000119106,2023-10-01,2099-12-31,NA
1340416,Exacerbation of osteoarthritis,Condition,OMOP Extension,Disorder,S,OMOP5166071,2022-05-06,2099-12-31,NA
1340525,Rapidly progressive osteoarthritis,Condition,OMOP Extension,Disorder,S,OMOP5166180,2022-05-06,2099-12-31,NA
1340526,Rapidly progressive osteoarthritis type 1,Condition,OMOP Extension,Disorder,S,OMOP5166181,2022-05-06,2099-12-31,NA
1340527,Rapidly progressive osteoarthritis type 2,Condition,OMOP Extension,Disorder,S,OMOP5166182,2022-05-06,2099-12-31,NA
1448869,Osteoarthritis of spine,Condition,SNOMED,Disorder,S,1343601009,2024-11-01,2099-12-31,NA
1448870,Osteoarthritis of thoracic spine,Condition,SNOMED,Disorder,S,1343603007,2024-11-01,2099-12-31,NA
1448871,Osteoarthritis of cervical spine,Condition,SNOMED,Disorder,S,1343604001,2024-11-01,2099-12-31,NA
1448872,Osteoarthritis of lumbar spine,Condition,SNOMED,Disorder,S,1343605000,2024-11-01,2099-12-31,NA
3180503,Scapholunate advanced collapse,Condition,Nebraska Lexicon,Clinical Finding,S,22450001000004109,2016-01-28,2099-12-31,NA
3186591,Osteoarthritis of sacroiliac joint,Condition,Nebraska Lexicon,Clinical Finding,S,18860001000004104,2016-01-28,2099-12-31,NA
4003507,Osteoarthritis of temporomandibular joint,Condition,SNOMED,Disorder,S,109668000,2002-01-31,2099-12-31,NA
4035439,Idiopathic osteoarthritis,Condition,SNOMED,Disorder,S,239862000,2002-01-31,2099-12-31,NA
4035440,Osteoarthritis of acromioclavicular joint,Condition,SNOMED,Disorder,S,239865003,2002-01-31,2099-12-31,NA
4035441,Osteoarthritis of wrist,Condition,SNOMED,Disorder,S,239867006,2002-01-31,2099-12-31,NA
4035442,Osteoarthritis of first metatarsophalangeal joint,Condition,SNOMED,Disorder,S,239877008,2002-01-31,2099-12-31,NA
4035756,Osteoarthritis of metacarpophalangeal joint of finger,Condition,SNOMED,Disorder,S,239871009,2002-01-31,2099-12-31,NA
4079749,Osteoarthritis of hip,Condition,SNOMED,Disorder,S,239872002,2002-01-31,2099-12-31,NA
4079750,Osteoarthritis of knee,Condition,SNOMED,Disorder,S,239873007,2002-01-31,2099-12-31,NA
4083694,Osteoarthritis of spinal facet joint,Condition,SNOMED,Disorder,S,239863005,2002-01-31,2099-12-31,NA
4083695,Osteoarthritis of elbow,Condition,SNOMED,Disorder,S,239866002,2002-01-31,2099-12-31,NA
4083696,Osteoarthritis of ankle,Condition,SNOMED,Disorder,S,239874001,2002-01-31,2099-12-31,NA
4083698,Osteoarthritis of subtalar joint,Condition,SNOMED,Disorder,S,239876004,2002-01-31,2099-12-31,NA
4116769,Osteoarthritis of bilateral hip joints due to and following trauma,Condition,SNOMED,Disorder,S,201857000,2002-01-31,2099-12-31,NA
4144996,Generalized osteoarthritis of the hand,Condition,SNOMED,Disorder,S,267889007,2002-01-31,2099-12-31,NA
4147779,Osteoarthritis of multiple joints,Condition,SNOMED,Disorder,S,268054009,2002-01-31,2099-12-31,NA
4150309,"Localized, secondary osteoarthritis of the pelvic region and thigh",Condition,SNOMED,Disorder,S,267890003,2002-01-31,2099-12-31,NA
4160051,Osteoarthritis of glenohumeral joint,Condition,SNOMED,Disorder,S,373623009,2002-07-31,2099-12-31,NA
4173669,Osteoarthritis of metacarpophalangeal joint,Condition,SNOMED,Disorder,S,275324008,2002-01-31,2099-12-31,NA
4185423,Chronic osteoarthritis,Condition,SNOMED,Disorder,S,43829003,2002-01-31,2099-12-31,NA
4197476,"Localized, primary osteoarthritis of the wrist",Condition,SNOMED,Disorder,S,313257005,2002-01-31,2099-12-31,NA
4197477,"Localized, primary osteoarthritis of elbow",Condition,SNOMED,Disorder,S,313259008,2002-01-31,2099-12-31,NA
4201372,Acute osteoarthritis of shoulder region,Condition,SNOMED,Disorder,S,432733005,2008-07-31,2099-12-31,NA
4202790,Osteoarthritis of foot joint,Condition,SNOMED,Disorder,S,309246000,2002-01-31,2099-12-31,NA
4209089,"Localized, primary osteoarthritis of toe",Condition,SNOMED,Disorder,S,313258000,2002-01-31,2099-12-31,NA
4219481,Osteoarthritis of ankle and/or foot,Condition,SNOMED,Disorder,S,82300000,2002-01-31,2099-12-31,NA
4323570,Secondary localized osteoarthrosis of multiple sites,Condition,SNOMED,Disorder,S,7126001,2002-01-31,2099-12-31,NA
4327181,Interphalangeal osteoarthritis,Condition,SNOMED,Disorder,S,74885006,2002-01-31,2099-12-31,NA
4343918,Osteoarthritis of finger joint,Condition,SNOMED,Disorder,S,239868001,2002-01-31,2099-12-31,NA
4343919,Osteoarthritis of toe joint,Condition,SNOMED,Disorder,S,239878003,2002-01-31,2099-12-31,NA
4343920,Endemic osteoarthritis,Condition,SNOMED,Disorder,S,239883006,2002-01-31,2099-12-31,NA
4343921,Malemud disease,Condition,SNOMED,Disorder,S,239884000,2002-01-31,2099-12-31,NA
4344156,Otto's pelvis,Condition,SNOMED,Disorder,S,239881008,2002-01-31,2099-12-31,NA
4346972,Osteoarthritis of distal interphalangeal joint,Condition,SNOMED,Disorder,S,239869009,2002-01-31,2099-12-31,NA
4346973,Osteoarthritis of proximal interphalangeal joint,Condition,SNOMED,Disorder,S,239870005,2002-01-31,2099-12-31,NA
35615108,Bilateral osteoarthritis of midtarsal joints of feet,Condition,SNOMED,Disorder,S,16015391000119105,2018-07-31,2099-12-31,NA
36684452,Bilateral osteoarthritis of feet,Condition,SNOMED,Disorder,S,112961000119103,2019-01-31,2099-12-31,NA
36684453,Bilateral osteoarthritis of ankles,Condition,SNOMED,Disorder,S,112971000119109,2019-01-31,2099-12-31,NA
36684454,Bilateral osteoarthritis of knees,Condition,SNOMED,Disorder,S,112981000119107,2019-01-31,2099-12-31,NA
36684455,Osteoarthritis of bilateral hip joints,Condition,SNOMED,Disorder,S,112991000119105,2019-01-31,2099-12-31,NA
36684456,Bilateral osteoarthritis of finger of hands,Condition,SNOMED,Disorder,S,113001000119106,2019-01-31,2099-12-31,NA
36684457,Osteoarthritis of joint of bilateral hands,Condition,SNOMED,Disorder,S,113011000119109,2019-01-31,2099-12-31,NA
36684458,Bilateral wrist osteoarthritis,Condition,SNOMED,Disorder,S,113021000119102,2019-01-31,2099-12-31,NA
36684459,Bilateral shoulder osteoarthritis,Condition,SNOMED,Disorder,S,113041000119108,2019-01-31,2099-12-31,NA
36712696,Osteoarthritis of right foot,Condition,SNOMED,Disorder,S,1074461000119100,2017-01-31,2099-12-31,NA
36712697,Osteoarthritis of left foot,Condition,SNOMED,Disorder,S,1074491000119107,2017-01-31,2099-12-31,NA
36713091,Bilateral osteoarthritis of first carpometacarpal joint,Condition,SNOMED,Disorder,S,303041000119104,2017-01-31,2099-12-31,NA
36713098,Osteoarthritis of joint of left hand,Condition,SNOMED,Disorder,S,318661000119102,2017-01-31,2099-12-31,NA
36713099,Osteoarthritis of joint of left shoulder region,Condition,SNOMED,Disorder,S,318671000119108,2017-01-31,2099-12-31,NA
36713100,Osteoarthritis of joint of left wrist,Condition,SNOMED,Disorder,S,318681000119106,2017-01-31,2099-12-31,NA
36713101,Osteoarthritis of joint of right ankle and/or foot,Condition,SNOMED,Disorder,S,318691000119109,2017-01-31,2099-12-31,NA
36713102,Osteoarthritis of joint of right hand,Condition,SNOMED,Disorder,S,318711000119107,2017-01-31,2099-12-31,NA
36713103,Osteoarthritis of joint of right shoulder region,Condition,SNOMED,Disorder,S,318721000119100,2017-01-31,2099-12-31,NA
36713104,Osteoarthritis of joint of right wrist,Condition,SNOMED,Disorder,S,318731000119102,2017-01-31,2099-12-31,NA
36713109,Osteoarthritis of left hip joint,Condition,SNOMED,Disorder,S,323291000119108,2017-01-31,2099-12-31,NA
36713110,Osteoarthritis of right hip joint,Condition,SNOMED,Disorder,S,323311000119107,2017-01-31,2099-12-31,NA
36713111,Osteoarthritis of right knee joint,Condition,SNOMED,Disorder,S,323321000119100,2017-01-31,2099-12-31,NA
36717036,Osteoarthritis of left knee joint,Condition,SNOMED,Disorder,S,323301000119109,2017-01-31,2099-12-31,NA
36717301,Osteoarthritis of joint of left ankle,Condition,SNOMED,Disorder,S,318641000119101,2017-01-31,2099-12-31,NA
36717302,Osteoarthritis of joint of right elbow,Condition,SNOMED,Disorder,S,318701000119109,2017-01-31,2099-12-31,NA
37017534,Osteoarthritis of lumbar spinal facet joint,Condition,SNOMED,Disorder,S,713826008,2016-01-31,2099-12-31,NA
37018720,Osteoarthritis of facet joint of thoracic spine,Condition,SNOMED,Disorder,S,713482002,2016-01-31,2099-12-31,NA
37108600,Osteoarthritis of right sternoclavicular joint,Condition,SNOMED,Disorder,S,1074391000119103,2017-07-31,2099-12-31,NA
37108601,Osteoarthritis of right foot due to trauma,Condition,SNOMED,Disorder,S,1074521000119109,2017-07-31,2099-12-31,NA
37108770,Osteoarthritis of left patellofemoral joint,Condition,SNOMED,Disorder,S,12367411000119102,2017-07-31,2099-12-31,NA
37108771,Bilateral patellofemoral joint osteoarthritis,Condition,SNOMED,Disorder,S,12367461000119104,2017-07-31,2099-12-31,NA
37108902,Osteoarthritis of right temporomandibular joint,Condition,SNOMED,Disorder,S,15686041000119102,2017-07-31,2099-12-31,NA
37108903,Osteoarthritis of left temporomandibular joint,Condition,SNOMED,Disorder,S,15686121000119109,2017-07-31,2099-12-31,NA
37108918,Osteoarthritis of left subtalar joint,Condition,SNOMED,Disorder,S,15722441000119106,2017-07-31,2099-12-31,NA
37108919,Osteoarthritis of right subtalar joint,Condition,SNOMED,Disorder,S,15722521000119101,2017-07-31,2099-12-31,NA
37108920,Bilateral osteoarthritis of first metatarsophalangeal joint of feet,Condition,SNOMED,Disorder,S,15722561000119106,2017-07-31,2099-12-31,NA
37109099,Osteoarthritis of left ankle due to trauma,Condition,SNOMED,Disorder,S,16583281000119101,2017-07-31,2099-12-31,NA
37109100,Osteoarthritis of right ankle due to trauma,Condition,SNOMED,Disorder,S,16583321000119106,2017-07-31,2099-12-31,NA
37109101,Osteoarthritis of joint of right ankle,Condition,SNOMED,Disorder,S,16583361000119101,2017-07-31,2099-12-31,NA
37117087,Osteoarthritis of right patellofemoral joint,Condition,SNOMED,Disorder,S,12367361000119109,2017-07-31,2099-12-31,NA
37117136,Osteoarthritis of first metatarsophalangeal joint of right foot,Condition,SNOMED,Disorder,S,1074481000119109,2017-07-31,2099-12-31,NA
37117137,Osteoarthritis of first metatarsophalangeal joint of left foot,Condition,SNOMED,Disorder,S,1074511000119102,2017-07-31,2099-12-31,NA
37168894,Secondary osteoarthritis of knee joint,Condition,SNOMED,Disorder,S,1287058006,2023-07-31,2099-12-31,NA
37203942,Aneurysm osteoarthritis syndrome,Condition,SNOMED,Disorder,S,785808002,2019-07-31,2099-12-31,NA
37208265,Bilateral osteoarthritis of sternoclavicular joints,Condition,SNOMED,Disorder,S,1074411000119103,2019-07-31,2099-12-31,NA
37209320,Bilateral osteoarthritis of temporomandibular joints,Condition,SNOMED,Disorder,S,15686081000119107,2019-07-31,2099-12-31,NA
37310642,Osteoarthritis of right hip joint due to dysplasia,Condition,SNOMED,Disorder,S,323171000119101,2020-01-31,2099-12-31,NA
37310643,Osteoarthritis of left hip joint due to dysplasia,Condition,SNOMED,Disorder,S,323161000119107,2020-01-31,2099-12-31,NA
37311898,Osteoarthritis of wrist and hand due to and following trauma,Condition,SNOMED,Disorder,S,789002007,2020-01-31,2099-12-31,NA
37311900,Osteoarthritis of hip due to and following trauma,Condition,SNOMED,Disorder,S,789000004,2020-01-31,2099-12-31,NA
37399301,Advanced collapse of scapholunate joint due to osteoarthritis,Condition,SNOMED,Disorder,S,107881000119100,2016-07-31,2099-12-31,NA
40481943,Secondary osteoarthritis,Condition,SNOMED,Disorder,S,443524000,2010-01-31,2099-12-31,NA
40483794,Osteoarthritis of pelvis,Condition,SNOMED,Disorder,S,445478004,2010-07-31,2099-12-31,NA
42534855,Osteoarthritis of left sternoclavicular joint,Condition,SNOMED,Disorder,S,1074451000119102,2018-01-31,2099-12-31,NA
42534856,Osteoarthritis of midtarsal joint of right foot,Condition,SNOMED,Disorder,S,1074471000119106,2018-01-31,2099-12-31,NA
42534857,Osteoarthritis of midtarsal joint of left foot,Condition,SNOMED,Disorder,S,1074501000119100,2018-01-31,2099-12-31,NA
42534859,Osteoarthritis of left foot due to trauma,Condition,SNOMED,Disorder,S,1074531000119107,2018-01-31,2099-12-31,NA
42534860,Osteoarthritis of right sacroiliac joint,Condition,SNOMED,Disorder,S,1074561000119104,2018-01-31,2099-12-31,NA
42535069,Bilateral osteoarthritis of sacroiliac joints,Condition,SNOMED,Disorder,S,15722961000119101,2018-01-31,2099-12-31,NA
42535128,Bilateral osteoarthritis of feet due to trauma,Condition,SNOMED,Disorder,S,16010951000119105,2018-01-31,2099-12-31,NA
42535499,Osteoarthritis of joint of left elbow,Condition,SNOMED,Disorder,S,318651000119104,2018-01-31,2099-12-31,NA
42537576,Osteoarthritis of joint of left ankle and/or foot,Condition,SNOMED,Disorder,S,737057000,2018-01-31,2099-12-31,NA
42539033,Oligoosteoarthritis,Condition,SNOMED,Disorder,S,735598004,2018-01-31,2099-12-31,NA
42539214,Osteoarthritis of left sacroiliac joint,Condition,SNOMED,Disorder,S,1074571000119105,2018-01-31,2099-12-31,NA
42573344,Septic osteoarthritis,Condition,SNOMED Veterinary,Clinical Finding,S,40941000009109,2008-08-29,2099-12-31,NA
42597175,Degenerative joint disease of humeroradial joint,Condition,SNOMED Veterinary,Clinical Finding,S,319791000009104,2010-12-21,2099-12-31,NA
42597186,Osteoarthritis of distal interphalangeal joint,Condition,SNOMED Veterinary,Clinical Finding,S,319961000009109,2010-12-21,2099-12-31,NA
42597194,Osteoarthritis of proximal interphalangeal joint,Condition,SNOMED Veterinary,Clinical Finding,S,320041000009105,2010-12-21,2099-12-31,NA
42597215,Degenerative joint disease of fetlock joint,Condition,SNOMED Veterinary,Clinical Finding,S,320241000009104,2010-12-22,2099-12-31,NA
42598665,Distal intertarsal osteoarthritis,Condition,SNOMED Veterinary,Clinical Finding,S,336891000009106,2014-01-31,2099-12-31,NA
42872530,Patellofemoral osteoarthritis,Condition,SNOMED,Disorder,S,450521003,2012-07-31,2099-12-31,NA
44783204,Post infectious osteoarthritis,Condition,SNOMED,Disorder,S,699261008,2014-01-31,2099-12-31,NA
44783205,Post traumatic osteoarthritis,Condition,SNOMED,Disorder,S,699262001,2014-01-31,2099-12-31,NA
45763782,Primary osteoarthritis of ankle,Condition,SNOMED,Disorder,S,700293006,2014-07-31,2099-12-31,NA
45763783,Secondary osteoarthritis of ankle,Condition,SNOMED,Disorder,S,700294000,2014-07-31,2099-12-31,NA
45763784,Osteoarthritis of ankle secondary to trauma,Condition,SNOMED,Disorder,S,700295004,2014-07-31,2099-12-31,NA
45763792,Primary calcaneocuboid osteoarthritis,Condition,SNOMED,Disorder,S,700304006,2014-07-31,2099-12-31,NA
45763793,Osteoarthritis of calcaneocuboid joint,Condition,SNOMED,Disorder,S,700305007,2014-07-31,2099-12-31,NA
45763794,Secondary calcaneocuboid osteoarthritis,Condition,SNOMED,Disorder,S,700307004,2014-07-31,2099-12-31,NA
45763799,Calcaneocuboid osteoarthritis secondary to trauma,Condition,SNOMED,Disorder,S,700312003,2014-07-31,2099-12-31,NA
45763800,Primary subtalar osteoarthritis,Condition,SNOMED,Disorder,S,700313008,2014-07-31,2099-12-31,NA
45763801,Secondary osteoarthritis of subtalar joint,Condition,SNOMED,Disorder,S,700314002,2014-07-31,2099-12-31,NA
45763802,Subtalar osteoarthritis secondary to inflammatory arthritis,Condition,SNOMED,Disorder,S,700316000,2014-07-31,2099-12-31,NA
45763803,Calcaneocuboid osteoarthritis secondary to inflammatory arthritis,Condition,SNOMED,Disorder,S,700317009,2014-07-31,2099-12-31,NA
45763804,Osteoarthritis of ankle secondary to inflammatory arthritis,Condition,SNOMED,Disorder,S,700318004,2014-07-31,2099-12-31,NA
45763809,Osteoarthritis of talonavicular joint,Condition,SNOMED,Disorder,S,700324005,2014-07-31,2099-12-31,NA
45763810,Primary talonavicular osteoarthritis,Condition,SNOMED,Disorder,S,700325006,2014-07-31,2099-12-31,NA
45763812,Talonavicular osteoarthritis secondary to trauma,Condition,SNOMED,Disorder,S,700328008,2014-07-31,2099-12-31,NA
45763815,Talonavicular osteoarthritis secondary to inflammatory arthritis,Condition,SNOMED,Disorder,S,700331009,2014-07-31,2099-12-31,NA
45763816,Secondary osteoarthritis of first metatarsophalangeal joint,Condition,SNOMED,Disorder,S,700332002,2014-07-31,2099-12-31,NA
45763817,Primary osteoarthritis of first metatarsophalangeal joint,Condition,SNOMED,Disorder,S,700333007,2014-07-31,2099-12-31,NA
45763819,Osteoarthritis of first metatarsophalangeal joint secondary to inflammatory arthritis,Condition,SNOMED,Disorder,S,700336004,2014-07-31,2099-12-31,NA
45765977,Secondary osteoarthritis of midfoot,Condition,SNOMED,Disorder,S,703050003,2014-07-31,2099-12-31,NA
45765978,Osteoarthritis of midfoot,Condition,SNOMED,Disorder,S,703051004,2014-07-31,2099-12-31,NA
45765979,Primary osteoarthritis of midfoot,Condition,SNOMED,Disorder,S,703052006,2014-07-31,2099-12-31,NA
45765980,Osteoarthritis of midfoot secondary to trauma,Condition,SNOMED,Disorder,S,703053001,2014-07-31,2099-12-31,NA
45765981,Osteoarthritis of midfoot secondary to inflammatory arthritis,Condition,SNOMED,Disorder,S,703054007,2014-07-31,2099-12-31,NA
45773205,Osteoarthritis of subtalar joint secondary to trauma,Condition,SNOMED,Disorder,S,700315001,2014-07-31,2099-12-31,NA
45773206,Secondary talonavicular osteoarthritis,Condition,SNOMED,Disorder,S,700326007,2014-07-31,2099-12-31,NA
45773207,Osteoarthritis of first metatarsophalangeal joint secondary to trauma,Condition,SNOMED,Disorder,S,700335000,2014-07-31,2099-12-31,NA
46273178,Osteoarthritis of hip due to dysplasia,Condition,SNOMED,Disorder,S,712504007,2015-07-31,2099-12-31,NA
