concept_id,concept_name,domain_id,vocabulary_id,concept_class_id,standard_concept,concept_code,valid_start_date,valid_end_date,invalid_reason
4066604,Single-level lumbosacral spondylosis with myelopathy,Condition,SNOMED,Disorder,S,202678002,2002-01-31,2099-12-31,NA
4066606,Cervical spondylosis with vascular compression,Condition,SNOMED,Disorder,S,202687006,2002-01-31,2099-12-31,NA
4066607,Single-level thoracic spondylosis with radiculopathy,Condition,SNOMED,Disorder,S,202689009,2002-01-31,2099-12-31,NA
4066611,Disc prolapse with myelopathy,Condition,SNOMED,Disorder,S,202728009,2002-01-31,2099-12-31,NA
4066612,Cervical disc prolapse with myelopathy,Condition,SNOMED,Disorder,S,202729001,2002-01-31,2099-12-31,NA
4066616,Resorption of thoracic disc,Condition,SNOMED,Disorder,S,202750005,2002-01-31,2099-12-31,NA
4067311,Lumbar discitis,Condition,SNOMED,Disorder,S,202752002,2002-01-31,2099-12-31,NA
4067312,Infection of intervertebral disc - pyogenic,Condition,SNOMED,Disorder,S,202756004,2002-01-31,2099-12-31,NA
4067313,Cervical disc disorder with radiculopathy,Condition,SNOMED,Disorder,S,202757008,2002-01-31,2099-12-31,NA
4067527,Multiple-level cervical spondylosis without myelopathy,Condition,SNOMED,Disorder,S,202659002,2002-01-31,2099-12-31,NA
4067528,Two-level thoracic spondylosis without myelopathy,Condition,SNOMED,Disorder,S,202667005,2002-01-31,2099-12-31,NA
4067531,Multiple-level lumbosacral spondylosis with radiculopathy,Condition,SNOMED,Disorder,S,202696006,2002-01-31,2099-12-31,NA
4067532,Neuropathic spondylopathy,Condition,SNOMED,Disorder,S,202700003,2002-01-31,2099-12-31,NA
4067539,Cervical discitis,Condition,SNOMED,Disorder,S,202744000,2002-01-31,2099-12-31,NA
4067540,Resorption of cervical disc,Condition,SNOMED,Disorder,S,202746003,2002-01-31,2099-12-31,NA
4067542,Resorption of lumbar disc,Condition,SNOMED,Disorder,S,202754001,2002-01-31,2099-12-31,NA
4068381,Multiple-level lumbosacral spondylosis without myelopathy,Condition,SNOMED,Disorder,S,202676003,2002-01-31,2099-12-31,NA
4068382,Two-level lumbosacral spondylosis with myelopathy,Condition,SNOMED,Disorder,S,202679005,2002-01-31,2099-12-31,NA
4068473,Multiple-level lumbosacral spondylosis with myelopathy,Condition,SNOMED,Disorder,S,202680008,2002-01-31,2099-12-31,NA
4068474,Two-level thoracic spondylosis with radiculopathy,Condition,SNOMED,Disorder,S,202690000,2002-01-31,2099-12-31,NA
4068475,Multiple-level thoracic spondylosis with radiculopathy,Condition,SNOMED,Disorder,S,202692008,2002-01-31,2099-12-31,NA
4068476,Single-level lumbosacral spondylosis with radiculopathy,Condition,SNOMED,Disorder,S,202694009,2002-01-31,2099-12-31,NA
4068477,Two-level lumbosacral spondylosis with radiculopathy,Condition,SNOMED,Disorder,S,202695005,2002-01-31,2099-12-31,NA
4068481,Prolapsed thoracic intervertebral disc without myelopathy,Condition,SNOMED,Disorder,S,202707000,2002-01-31,2099-12-31,NA
4068482,Prolapsed lumbar intervertebral disc,Condition,SNOMED,Disorder,S,202708005,2002-01-31,2099-12-31,NA
4068604,Single-level cervical spondylosis without myelopathy,Condition,SNOMED,Disorder,S,202657000,2002-01-31,2099-12-31,NA
4068605,Two-level cervical spondylosis without myelopathy,Condition,SNOMED,Disorder,S,202658005,2002-01-31,2099-12-31,NA
4068609,Single-level thoracic spondylosis with myelopathy,Condition,SNOMED,Disorder,S,202670009,2002-01-31,2099-12-31,NA
4068610,Two-level thoracic spondylosis with myelopathy,Condition,SNOMED,Disorder,S,202671008,2002-01-31,2099-12-31,NA
4068611,Multiple-level thoracic spondylosis with myelopathy,Condition,SNOMED,Disorder,S,202672001,2002-01-31,2099-12-31,NA
4068616,Thoracic spondylosis with radiculopathy,Condition,SNOMED,Disorder,S,202688001,2002-01-31,2099-12-31,NA
4068617,Lumbosacral spondylosis with radiculopathy,Condition,SNOMED,Disorder,S,202693003,2002-01-31,2099-12-31,NA
4068624,Thoracic disc prolapse with myelopathy,Condition,SNOMED,Disorder,S,202730006,2002-01-31,2099-12-31,NA
4068626,Cervical disc prolapse with radiculopathy,Condition,SNOMED,Disorder,S,202733008,2002-01-31,2099-12-31,NA
4068627,Lumbar disc prolapse with cauda equina compression,Condition,SNOMED,Disorder,S,202736000,2002-01-31,2099-12-31,NA
4068628,Thoracic discitis,Condition,SNOMED,Disorder,S,202748002,2002-01-31,2099-12-31,NA
4068629,Calcification of thoracic disc,Condition,SNOMED,Disorder,S,202751009,2002-01-31,2099-12-31,NA
4068712,Calcification of lumbar disc,Condition,SNOMED,Disorder,S,202755000,2002-01-31,2099-12-31,NA
4068848,Subluxation complex (vertebral),Condition,SNOMED,Disorder,S,203709007,2002-01-31,2099-12-31,NA
4069202,Lumbar disc prolapse with myelopathy,Condition,SNOMED,Disorder,S,202731005,2002-01-31,2099-12-31,NA
4069203,Disc prolapse with radiculopathy,Condition,SNOMED,Disorder,S,202732003,2002-01-31,2099-12-31,NA
4069204,Thoracic disc prolapse with radiculopathy,Condition,SNOMED,Disorder,S,202734002,2002-01-31,2099-12-31,NA
4069205,Lumbar disc prolapse with radiculopathy,Condition,SNOMED,Disorder,S,202735001,2002-01-31,2099-12-31,NA
4069206,Annular tear of cervical disc,Condition,SNOMED,Disorder,S,202745004,2002-01-31,2099-12-31,NA
4069207,Calcification of cervical disc,Condition,SNOMED,Disorder,S,202747007,2002-01-31,2099-12-31,NA
4069208,Annular tear of thoracic disc,Condition,SNOMED,Disorder,S,202749005,2002-01-31,2099-12-31,NA
4069209,Annular tear of lumbar disc,Condition,SNOMED,Disorder,S,202753007,2002-01-31,2099-12-31,NA
4071597,Dislocation of spine due to birth trauma,Condition,SNOMED,Disorder,S,206221000,2002-01-31,2099-12-31,NA
4079735,Juvenile spondyloarthropathy,Condition,SNOMED,Disorder,S,239806000,2002-01-31,2099-12-31,NA
4083681,Juvenile ankylosing spondylitis,Condition,SNOMED,Disorder,S,239805001,2002-01-31,2099-12-31,NA
4083694,Osteoarthritis of spinal facet joint,Condition,SNOMED,Disorder,S,239863005,2002-01-31,2099-12-31,NA
4083817,Fracture dislocation of lumbosacral junction,Condition,SNOMED,Disorder,S,281909008,2002-01-31,2099-12-31,NA
4085246,Fracture dislocation of thoracolumbar junction,Condition,SNOMED,Disorder,S,281907005,2002-01-31,2099-12-31,NA
4085247,Fracture dislocation of cervicothoracic junction,Condition,SNOMED,Disorder,S,281908000,2002-01-31,2099-12-31,NA
4102481,Nerve root and plexus compressions in intervertebral disc disorders,Condition,SNOMED,Disorder,S,193119005,2002-01-31,2099-12-31,NA
4105009,Nerve root and plexus compressions in spondylosis,Condition,SNOMED,Disorder,S,193120004,2002-01-31,2099-12-31,NA
4111186,Congenital deformity of lumbosacral joint,Condition,SNOMED,Disorder,S,254034001,2002-01-31,2099-12-31,NA
4113599,Congenital lumbosacral fusion,Condition,SNOMED,Disorder,S,254039006,2002-01-31,2099-12-31,NA
4116439,Rheumatoid arthritis of cervical spine,Condition,SNOMED,Disorder,S,201764007,2002-01-31,2099-12-31,NA
4120327,Infective discitis,Condition,SNOMED,Disorder,S,302935008,2002-01-31,2099-12-31,NA
4122761,Oral lesion co-occurrent with reactive arthritis triad,Condition,SNOMED,Disorder,S,235066005,2002-01-31,2099-12-31,NA
4126944,Circinate balanitis co-occurrent with reactive arthritis triad,Condition,SNOMED,Disorder,S,236744002,2002-01-31,2099-12-31,NA
4134171,Dislocation of joint of spine,Condition,SNOMED,Disorder,S,263013004,2002-01-31,2099-12-31,NA
4134176,Subluxation of joint of cervical spine,Condition,SNOMED,Disorder,S,263040004,2002-01-31,2099-12-31,NA
4134177,Subluxation of atlantoaxial joint,Condition,SNOMED,Disorder,S,263042007,2002-01-31,2099-12-31,NA
4134178,Subluxation of joint of thoracic spine,Condition,SNOMED,Disorder,S,263043002,2002-01-31,2099-12-31,NA
4134179,Subluxation of sacrum,Condition,SNOMED,Disorder,S,263045009,2002-01-31,2099-12-31,NA
4134953,Back sprain excluding lumbosacral,Condition,SNOMED,Disorder,S,262995003,2002-01-31,2099-12-31,NA
4135076,Dislocation of atlanto-occipital joint,Condition,SNOMED,Disorder,S,263014005,2002-01-31,2099-12-31,NA
4135077,Dislocation of atlantoaxial joint,Condition,SNOMED,Disorder,S,263015006,2002-01-31,2099-12-31,NA
4135088,Subluxation of joint of lumbar spine,Condition,SNOMED,Disorder,S,263044008,2002-01-31,2099-12-31,NA
4135089,Subluxation of coccyx,Condition,SNOMED,Disorder,S,263046005,2002-01-31,2099-12-31,NA
4135096,Fracture dislocation of spine,Condition,SNOMED,Disorder,S,263068000,2002-01-31,2099-12-31,NA
4136566,Hangman fracture,Condition,SNOMED,Disorder,S,263070009,2002-01-31,2099-12-31,NA
4136567,Fracture dislocation of lumbar spine,Condition,SNOMED,Disorder,S,263072001,2002-01-31,2099-12-31,NA
4138152,Subluxation of joint of spine,Condition,SNOMED,Disorder,S,263039001,2002-01-31,2099-12-31,NA
4138153,Subluxation of atlanto-occipital joint,Condition,SNOMED,Disorder,S,263041000,2002-01-31,2099-12-31,NA
4138272,Fracture dislocation of cervical spine,Condition,SNOMED,Disorder,S,263069008,2002-01-31,2099-12-31,NA
4138273,Fracture dislocation of thoracic spine,Condition,SNOMED,Disorder,S,263071008,2002-01-31,2099-12-31,NA
4140532,Intervertebral disc rupture,Condition,SNOMED,Disorder,S,33132004,2002-01-31,2099-12-31,NA
4141028,Cervical disc disorder,Condition,SNOMED,Disorder,S,425878001,2007-07-31,2099-12-31,NA
4144898,Arthropathy of cervical spine facet joint,Condition,SNOMED,Disorder,S,427500003,2007-07-31,2099-12-31,NA
4144903,Synovial cyst of lumbar spine,Condition,SNOMED,Disorder,S,427518000,2007-07-31,2099-12-31,NA
4147005,Closed dislocation atlanto-occipital joint,Condition,SNOMED,Disorder,S,269115004,2002-01-31,2099-12-31,NA
4147006,Closed dislocation atlantoaxial joint,Condition,SNOMED,Disorder,S,269116003,2002-01-31,2099-12-31,NA
4147007,Open dislocation atlanto-occipital joint,Condition,SNOMED,Disorder,S,269122007,2002-01-31,2099-12-31,NA
4147008,Open dislocation C3/C4,Condition,SNOMED,Disorder,S,269125009,2002-01-31,2099-12-31,NA
4147009,Open dislocation C6/C7,Condition,SNOMED,Disorder,S,269128006,2002-01-31,2099-12-31,NA
4149553,Closed dislocation C2/C3,Condition,SNOMED,Disorder,S,269117007,2002-01-31,2099-12-31,NA
4149554,Closed dislocation C3/C4,Condition,SNOMED,Disorder,S,269118002,2002-01-31,2099-12-31,NA
4149555,Closed dislocation C5/C6,Condition,SNOMED,Disorder,S,269120004,2002-01-31,2099-12-31,NA
4149556,Open dislocation atlantoaxial joint,Condition,SNOMED,Disorder,S,269123002,2002-01-31,2099-12-31,NA
4149557,Open dislocation C4/C5,Condition,SNOMED,Disorder,S,269126005,2002-01-31,2099-12-31,NA
4149558,Open dislocation C5/C6,Condition,SNOMED,Disorder,S,269127001,2002-01-31,2099-12-31,NA
4150319,Spondylosis and allied disorders,Condition,SNOMED,Disorder,S,267969005,2002-01-31,2099-12-31,NA
4150320,Prolapsed cervical intervertebral disc without myelopathy,Condition,SNOMED,Disorder,S,267974002,2002-01-31,2099-12-31,NA
4151088,Closed dislocation C4/C5,Condition,SNOMED,Disorder,S,269119005,2002-01-31,2099-12-31,NA
4151089,Open dislocation C2/C3,Condition,SNOMED,Disorder,S,269124008,2002-01-31,2099-12-31,NA
4153359,Arthritis of spine,Condition,SNOMED,Disorder,S,371082009,2002-07-31,2099-12-31,NA
4153731,Closed dislocation C6/C7,Condition,SNOMED,Disorder,S,269121000,2002-01-31,2099-12-31,NA
4157453,Disorder of joint of spine,Condition,SNOMED,Disorder,S,372109003,2002-07-31,2099-12-31,NA
4167093,Lumbar disc lesion,Condition,SNOMED,Disorder,S,274137005,2002-01-31,2099-12-31,NA
4176931,Arthropathy in Behcet's syndrome of the spine,Condition,SNOMED,Disorder,S,427967009,2008-01-31,2099-12-31,NA
4177078,Traumatic arthropathy of the spine,Condition,SNOMED,Disorder,S,428144009,2008-01-31,2099-12-31,NA
4177535,Rotatory subluxation of atlantoaxial joint,Condition,SNOMED,Disorder,S,428799009,2008-01-31,2099-12-31,NA
4178926,Arthropathy of lumbar facet joint,Condition,SNOMED,Disorder,S,428671008,2008-01-31,2099-12-31,NA
4179506,Climacteric arthritis of spine,Condition,SNOMED,Disorder,S,429298008,2008-01-31,2099-12-31,NA
4180129,Arthropathy of spinal facet joint,Condition,SNOMED,Disorder,S,429350001,2008-01-31,2099-12-31,NA
4180469,Sacral arthritis,Condition,SNOMED,Disorder,S,429555005,2008-01-31,2099-12-31,NA
4180877,Arthropathy of thoracic facet joint,Condition,SNOMED,Disorder,S,428460002,2008-01-31,2099-12-31,NA
4181453,Kashin-Beck disease of spine,Condition,SNOMED,Disorder,S,428857003,2008-01-31,2099-12-31,NA
4181891,Thoracic facet joint effusion,Condition,SNOMED,Disorder,S,298158002,2002-01-31,2099-12-31,NA
4184086,Spinal effusion,Condition,SNOMED,Disorder,S,298156003,2002-01-31,2099-12-31,NA
4184087,Lumbar facet joint effusion,Condition,SNOMED,Disorder,S,298159005,2002-01-31,2099-12-31,NA
4185030,Cervical facet joint effusion,Condition,SNOMED,Disorder,S,298157007,2002-01-31,2099-12-31,NA
4187244,Ankylosis of spine,Condition,SNOMED,Disorder,S,47049007,2002-01-31,2099-12-31,NA
4188350,Lumbago-sciatica due to displacement of lumbar intervertebral disc,Condition,SNOMED,Disorder,S,46960006,2002-01-31,2099-12-31,NA
4193060,Dislocation of lumbar facet joint,Condition,SNOMED,Disorder,S,314198003,2002-01-31,2099-12-31,NA
4194877,Spinal subluxation with lumbar cord lesion,Condition,SNOMED,Disorder,S,312788000,2002-01-31,2099-12-31,NA
4194878,Spinal subluxation with cauda equina lesion,Condition,SNOMED,Disorder,S,312792007,2002-01-31,2099-12-31,NA
4194890,Spinal dislocation with cervical cord lesion,Condition,SNOMED,Disorder,S,312837005,2002-01-31,2099-12-31,NA
4194891,Spinal dislocation with lumbar cord lesion,Condition,SNOMED,Disorder,S,312839008,2002-01-31,2099-12-31,NA
4195780,Traumatic dislocation of joint of cervical vertebra,Condition,SNOMED,Disorder,S,44264009,2002-01-31,2099-12-31,NA
4196992,Dislocation of cervical facet joint,Condition,SNOMED,Disorder,S,314195000,2002-01-31,2099-12-31,NA
4196993,Dislocation of thoracic facet joint,Condition,SNOMED,Disorder,S,314197008,2002-01-31,2099-12-31,NA
4200420,Spinal arthritis deformans,Condition,SNOMED,Disorder,S,53332000,2002-01-31,2099-12-31,NA
4207923,Prolapsed lumbar intervertebral disc with sciatica,Condition,SNOMED,Disorder,S,311804006,2002-01-31,2099-12-31,NA
4208064,Spinal subluxation with cervical cord lesion,Condition,SNOMED,Disorder,S,312786001,2002-01-31,2099-12-31,NA
4221664,Circinate vulvovaginitis co-occurrent with reactive arthritis triad,Condition,SNOMED,Disorder,S,402338004,2003-07-31,2099-12-31,NA
4223486,Nail dystrophy co-occurrent with reactive arthritis triad,Condition,SNOMED,Disorder,S,402339007,2003-07-31,2099-12-31,NA
4225257,Herniation of nucleus pulposus,Condition,SNOMED,Disorder,S,84857004,2002-01-31,2099-12-31,NA
4227449,Spondylosis,Condition,SNOMED,Disorder,S,8847002,2002-01-31,2099-12-31,NA
4233947,Grisel's syndrome,Condition,SNOMED,Disorder,S,89902003,2002-01-31,2099-12-31,NA
4236035,Ossification of posterior longitudinal ligament,Condition,SNOMED,Disorder,S,90448008,2002-01-31,2099-12-31,NA
4236187,Sprain of sacrococcygeal ligament,Condition,SNOMED,Disorder,S,90631008,2002-01-31,2099-12-31,NA
4236724,Injury to ligament of cervical spine,Condition,SNOMED,Disorder,S,405561009,2004-01-31,2099-12-31,NA
4251033,Multiple open dislocations of back,Condition,SNOMED,Disorder,S,74177004,2002-01-31,2099-12-31,NA
4251304,Intervertebral disc prolapse,Condition,SNOMED,Disorder,S,73589001,2002-01-31,2099-12-31,NA
4260380,Closed dislocations of multiple cervical vertebrae,Condition,SNOMED,Disorder,S,44701004,2002-01-31,2099-12-31,NA
4264005,Multiple closed dislocations of back,Condition,SNOMED,Disorder,S,61041006,2002-01-31,2099-12-31,NA
4277533,Complete ankylosis of the spine,Condition,SNOMED,Disorder,S,36655007,2002-01-31,2099-12-31,NA
4289292,Adult osteochondritis of spine,Condition,SNOMED,Disorder,S,701003,2002-01-31,2099-12-31,NA
4300489,Cervical arthritis,Condition,SNOMED,Disorder,S,387801000,2003-01-31,2099-12-31,NA
4302686,Thoracic spondylosis,Condition,SNOMED,Disorder,S,387802007,2003-01-31,2099-12-31,NA
4304035,Thoracic arthritis,Condition,SNOMED,Disorder,S,1033009,2003-01-31,2099-12-31,NA
4308802,Cervical spondylosis,Condition,SNOMED,Disorder,S,387800004,2003-01-31,2099-12-31,NA
4323203,Allergic arthritis of spine,Condition,SNOMED,Disorder,S,428218004,2008-01-31,2099-12-31,NA
4338669,Ankylosis of lumbosacral joint,Condition,SNOMED,Disorder,S,87823004,2002-01-31,2099-12-31,NA
4344390,Intervertebral disk calcification,Condition,SNOMED,Disorder,S,240211000,2002-01-31,2099-12-31,NA
4344391,Tear of the annulus fibrosus of intervertebral disc,Condition,SNOMED,Disorder,S,240212007,2002-01-31,2099-12-31,NA
4345329,Prolapsed cervical intervertebral disc,Condition,SNOMED,Disorder,S,240215009,2002-01-31,2099-12-31,NA
4346975,Lumbar spondylosis,Condition,SNOMED,Disorder,S,239880009,2002-01-31,2099-12-31,NA
4347305,Prolapsed intervertebral disc without myelopathy,Condition,SNOMED,Disorder,S,240213002,2002-01-31,2099-12-31,NA
4347307,Prolapsed thoracic intervertebral disc,Condition,SNOMED,Disorder,S,240216005,2002-01-31,2099-12-31,NA
36683391,Rheumatoid arthritis of joint of spine,Condition,SNOMED,Disorder,S,781206002,2019-01-31,2099-12-31,NA
36684585,Spondylosis of cervicothoracic spine,Condition,SNOMED,Disorder,S,321311000119108,2019-01-31,2099-12-31,NA
36684586,Spondylosis of thoracolumbar spine,Condition,SNOMED,Disorder,S,321341000119107,2019-01-31,2099-12-31,NA
36713170,Cervical spine sprain,Condition,SNOMED,Disorder,S,36241000119108,2017-01-31,2099-12-31,NA
36714940,Arthritis of lumbosacral spine,Condition,SNOMED,Disorder,S,720363008,2017-01-31,2099-12-31,NA
36715121,Cardiomyopathy with cataract and hip spine disease syndrome,Condition,SNOMED,Disorder,S,720609003,2017-01-31,2099-12-31,NA
36715626,Traumatic subluxation of atlanto-occipital joint,Condition,SNOMED,Disorder,S,721352002,2017-01-31,2099-12-31,NA
36715627,Traumatic complete dislocation of atlantoaxial joint,Condition,SNOMED,Disorder,S,721354001,2017-01-31,2099-12-31,NA
36715628,Traumatic dislocation of second and third cervical vertebra,Condition,SNOMED,Disorder,S,721355000,2017-01-31,2099-12-31,NA
36715629,Traumatic dislocation of third and fourth cervical vertebra,Condition,SNOMED,Disorder,S,721356004,2017-01-31,2099-12-31,NA
36715630,Traumatic dislocation of fourth and fifth cervical vertebra,Condition,SNOMED,Disorder,S,721357008,2017-01-31,2099-12-31,NA
36715631,Traumatic dislocation of fifth and sixth cervical vertebra,Condition,SNOMED,Disorder,S,721358003,2017-01-31,2099-12-31,NA
36715632,Traumatic dislocation of sixth and seventh cervical vertebra,Condition,SNOMED,Disorder,S,721359006,2017-01-31,2099-12-31,NA
36715633,Traumatic dislocation of seventh cervical and first thoracic vertebra,Condition,SNOMED,Disorder,S,721360001,2017-01-31,2099-12-31,NA
36715634,Traumatic dislocation of multiple cervical vertebra,Condition,SNOMED,Disorder,S,721361002,2017-01-31,2099-12-31,NA
36716891,Axial spondyloarthritis,Condition,SNOMED,Disorder,S,723116002,2017-01-31,2099-12-31,NA
36716911,Trauma causing partial dislocation of atlantoaxial joint,Condition,SNOMED,Disorder,S,723145000,2017-01-31,2099-12-31,NA
36716984,Arthropathy of spinal facet joint co-occurrent and due to effusion,Condition,SNOMED,Disorder,S,79741000119108,2017-01-31,2099-12-31,NA
36717466,Traumatic complete dislocation of atlanto-occipital joint,Condition,SNOMED,Disorder,S,721353007,2017-01-31,2099-12-31,NA
37016164,Prolapse of thoracic intervertebral disc without radiculopathy,Condition,SNOMED,Disorder,S,13271000119101,2016-01-31,2099-12-31,NA
37016165,Prolapse of lumbar intervertebral disc without radiculopathy,Condition,SNOMED,Disorder,S,13291000119100,2016-01-31,2099-12-31,NA
37016245,Prolapse of cervical intervertebral disc without radiculopathy,Condition,SNOMED,Disorder,S,22531000119104,2016-01-31,2099-12-31,NA
37016284,Myelopathy co-occurrent and due to lumbosacral intervertebral disc disorder,Condition,SNOMED,Disorder,S,311191000119109,2016-01-31,2099-12-31,NA
37017464,Neoplasm of cervical atlantoaxial joint,Condition,SNOMED,Disorder,S,713741003,2016-01-31,2099-12-31,NA
37017494,Non-radiographic axial spondyloarthritis,Condition,SNOMED,Disorder,S,713777005,2016-01-31,2099-12-31,NA
37017534,Osteoarthritis of lumbar spinal facet joint,Condition,SNOMED,Disorder,S,713826008,2016-01-31,2099-12-31,NA
37017608,Lumbosacral spondylosis with root compression,Condition,SNOMED,Disorder,S,713911007,2016-01-31,2099-12-31,NA
37018720,Osteoarthritis of facet joint of thoracic spine,Condition,SNOMED,Disorder,S,713482002,2016-01-31,2099-12-31,NA
37018842,Disorder of lumbosacral intervertebral disc,Condition,SNOMED,Disorder,S,715057009,2016-01-31,2099-12-31,NA
37109063,Arthritis of facet joint of lumbar spine,Condition,SNOMED,Disorder,S,16426641000119101,2017-07-31,2099-12-31,NA
37109064,Arthritis of facet joint of cervical spine,Condition,SNOMED,Disorder,S,16426681000119106,2017-07-31,2099-12-31,NA
37109489,Pseudarthrosis following spinal fusion,Condition,SNOMED,Disorder,S,673581000119104,2017-07-31,2099-12-31,NA
37110357,Benign osteogenic neoplasm of articular cartilage of vertebral column,Condition,SNOMED,Disorder,S,724584009,2017-07-31,2099-12-31,NA
37110373,Intervertebral disc degeneration of cervical spine without prolapsed disc,Condition,SNOMED,Disorder,S,724604003,2017-07-31,2099-12-31,NA
37110374,Ossification of spinal ligament,Condition,SNOMED,Disorder,S,724605002,2017-07-31,2099-12-31,NA
37116470,Traumatic dislocation of atlanto-occipital joint,Condition,SNOMED,Disorder,S,733196009,2017-07-31,2099-12-31,NA
37116471,Traumatic dislocation of atlantoaxial joint,Condition,SNOMED,Disorder,S,733197000,2017-07-31,2099-12-31,NA
37117207,Occipitalization of atlas,Condition,SNOMED,Disorder,S,724616009,2017-07-31,2099-12-31,NA
37150958,Sacrococcygeal discitis,Condition,SNOMED,Disorder,S,305961000119100,2022-05-31,2099-12-31,NA
37160361,Post-traumatic spinal instability,Condition,SNOMED,Disorder,S,1162283001,2021-09-30,2099-12-31,NA
37160367,Mycobacterial discitis,Condition,SNOMED,Disorder,S,1162292003,2021-09-30,2099-12-31,NA
37160374,Separation of annulus fibrosus of intervertebral disc,Condition,SNOMED,Disorder,S,1162301000,2021-09-30,2099-12-31,NA
37160375,Ossification of ligamentum flavum,Condition,SNOMED,Disorder,S,1162302007,2021-09-30,2099-12-31,NA
37160396,Viral spondyloarthritis,Condition,SNOMED,Disorder,S,1162331006,2021-09-30,2099-12-31,NA
37160403,Ossification of posterior longitudinal ligament and ligamentum flavum,Condition,SNOMED,Disorder,S,1162342002,2021-09-30,2099-12-31,NA
37160410,Osteosarcoma of articular cartilage of vertebra,Condition,SNOMED,Disorder,S,1162353008,2021-09-30,2099-12-31,NA
37160412,Viral discitis,Condition,SNOMED,Disorder,S,1162355001,2021-09-30,2099-12-31,NA
37166490,Primary osteosarcoma of articular cartilage of vertebra,Condition,SNOMED,Disorder,S,1259637001,2022-12-31,2099-12-31,NA
37167559,Thoracic spinal cord lesion due to thoracic spinal dislocation,Condition,SNOMED,Disorder,S,1268463007,2023-04-30,2099-12-31,NA
37167998,Lesion of thoracic spinal cord due to closed dislocation of joint of thoracic spine,Condition,SNOMED,Disorder,S,1269342002,2023-04-30,2099-12-31,NA
37167999,Lesion of thoracic spinal cord due to open dislocation of joint of thoracic spine,Condition,SNOMED,Disorder,S,1269343007,2023-04-30,2099-12-31,NA
37168022,Anterior lesion of thoracic spinal cord due to closed dislocation of joint of thoracic spine,Condition,SNOMED,Disorder,S,1269375005,2023-04-30,2099-12-31,NA
37168023,Anterior lesion of thoracic spinal cord due to closed subluxation of joint of thoracic spine,Condition,SNOMED,Disorder,S,1269376006,2023-04-30,2099-12-31,NA
37168024,Central cord syndrome of thoracic spinal cord due to closed dislocation of joint of thoracic spine,Condition,SNOMED,Disorder,S,1269377002,2023-04-30,2099-12-31,NA
37168025,Posterior cord syndrome of thoracic spinal cord due to closed dislocation of joint of thoracic spine,Condition,SNOMED,Disorder,S,1269378007,2023-04-30,2099-12-31,NA
37168026,Complete lesion of thoracic spinal cord due to closed subluxation of joint of thoracic spine,Condition,SNOMED,Disorder,S,1269379004,2023-04-30,2099-12-31,NA
37168027,Anterior lesion of thoracic spinal cord due to open dislocation of joint of thoracic spine,Condition,SNOMED,Disorder,S,1269380001,2023-04-30,2099-12-31,NA
37168028,Central cord syndrome of thoracic spinal cord due to open dislocation of joint of thoracic spine,Condition,SNOMED,Disorder,S,1269381002,2023-04-30,2099-12-31,NA
37168029,Posterior cord syndrome of thoracic spinal cord due to open dislocation of joint of thoracic spine,Condition,SNOMED,Disorder,S,1269382009,2023-04-30,2099-12-31,NA
37168030,Complete lesion of thoracic spinal cord due to open subluxation of joint of thoracic spine,Condition,SNOMED,Disorder,S,1269383004,2023-04-30,2099-12-31,NA
37168031,Lesion of thoracic spinal cord due to subluxation of joint of thoracic spine,Condition,SNOMED,Disorder,S,1269385006,2023-04-30,2099-12-31,NA
37168032,Anterior lesion of thoracic spine due to open subluxation of joint of thoracic spine,Condition,SNOMED,Disorder,S,1269389000,2023-04-30,2099-12-31,NA
37168033,Central cord syndrome of thoracic spinal cord due to open subluxation of joint of thoracic spine,Condition,SNOMED,Disorder,S,1269390009,2023-04-30,2099-12-31,NA
37168034,Posterior cord syndrome of thoracic spinal cord due to open subluxation of joint of thoracic spine,Condition,SNOMED,Disorder,S,1269391008,2023-04-30,2099-12-31,NA
37168035,Central cord syndrome of thoracic spinal cord due to closed subluxation of joint of thoracic spine,Condition,SNOMED,Disorder,S,1269392001,2023-04-30,2099-12-31,NA
37168036,Posterior cord syndrome of thoracic spinal cord due to closed subluxation of joint of thoracic spine,Condition,SNOMED,Disorder,S,1269393006,2023-04-30,2099-12-31,NA
37169795,Mycobacterial spondyloarthritis,Condition,SNOMED,Disorder,S,1162330007,2021-09-30,2099-12-31,NA
37170948,Arthritis of joint of spine due to inflammatory bowel disease,Condition,SNOMED,Disorder,S,307261000119104,2022-04-30,2099-12-31,NA
37170967,Ankylosis of sacrococcygeal spine,Condition,SNOMED,Disorder,S,308591000119108,2022-03-31,2099-12-31,NA
37171002,Pyogenic infection of cervical intervertebral disc,Condition,SNOMED,Disorder,S,310491000119108,2022-04-30,2099-12-31,NA
