concept_id,concept_name,domain_id,vocabulary_id,concept_class_id,standard_concept,concept_code,valid_start_date,valid_end_date,invalid_reason
37171003,Pyogenic infection of cervicothoracic intervertebral disc,Condition,SNOMED,Disorder,S,310501000119101,2022-04-30,2099-12-31,NA
37171005,Pyogenic infection of lumbar intervertebral disc,Condition,SNOMED,Disorder,S,310511000119103,2022-04-30,2099-12-31,NA
37171006,Pyogenic infection of lumbosacral intervertebral disc,Condition,SNOMED,Disorder,S,310521000119105,2022-04-30,2099-12-31,NA
37171007,Pyogenic infection of sacrococcygeal intervertebral disc,Condition,SNOMED,Disorder,S,310551000119102,2022-04-30,2099-12-31,NA
37171008,Pyogenic infection of thoracic intervertebral disc,Condition,SNOMED,Disorder,S,310561000119100,2022-04-30,2099-12-31,NA
37171009,Pyogenic infection of thoracolumbar intervertebral disc,Condition,SNOMED,Disorder,S,310571000119106,2022-04-30,2099-12-31,NA
37171832,"Prolapsed cervical intervertebral disc, C3-C4",Condition,SNOMED,Disorder,S,42651000087103,2023-06-30,2099-12-31,NA
37171834,"Prolapsed cervical intervertebral disc, C4-C5",Condition,SNOMED,Disorder,S,42661000087100,2023-06-30,2099-12-31,NA
37171836,"Prolapsed cervical intervertebral disc, C5-C6",Condition,SNOMED,Disorder,S,42671000087109,2023-06-30,2099-12-31,NA
37171838,"Prolapsed cervical intervertebral disc, C6-C7",Condition,SNOMED,Disorder,S,42681000087106,2023-06-30,2099-12-31,NA
37171840,"Prolapsed cervical intervertebral disc, C7-T1",Condition,SNOMED,Disorder,S,42691000087108,2023-06-30,2099-12-31,NA
37171842,"Prolapsed thoracic intervertebral disc, T1-T2",Condition,SNOMED,Disorder,S,42701000087108,2023-06-30,2099-12-31,NA
37171845,"Prolapsed thoracic intervertebral disc, T10-T11",Condition,SNOMED,Disorder,S,42711000087105,2023-06-30,2099-12-31,NA
37171847,"Prolapsed thoracic intervertebral disc, T9-T10",Condition,SNOMED,Disorder,S,42721000087102,2023-06-30,2099-12-31,NA
37171849,"Prolapsed thoracic intervertebral disc, T2-T3",Condition,SNOMED,Disorder,S,42731000087100,2023-06-30,2099-12-31,NA
37171851,"Prolapsed thoracic intervertebral disc, T3-T4",Condition,SNOMED,Disorder,S,42741000087106,2023-06-30,2099-12-31,NA
37171853,"Prolapsed thoracic intervertebral disc, T4-T5",Condition,SNOMED,Disorder,S,42751000087109,2023-06-30,2099-12-31,NA
37171855,"Prolapsed thoracic intervertebral disc, T5-T6",Condition,SNOMED,Disorder,S,42761000087107,2023-06-30,2099-12-31,NA
37171857,"Prolapsed thoracic intervertebral disc, T6-T7",Condition,SNOMED,Disorder,S,42771000087103,2023-06-30,2099-12-31,NA
37171859,"Prolapsed thoracic intervertebral disc, T7-T8",Condition,SNOMED,Disorder,S,42781000087101,2023-06-30,2099-12-31,NA
37171861,"Prolapsed thoracic intervertebral disc, T8-T9",Condition,SNOMED,Disorder,S,42791000087104,2023-06-30,2099-12-31,NA
37171957,"Prolapsed lumbar intervertebral disc, L1-L2",Condition,SNOMED,Disorder,S,43351000087103,2023-06-30,2099-12-31,NA
37171960,"Prolapsed lumbar intervertebral disc, L2-L3",Condition,SNOMED,Disorder,S,43371000087109,2023-06-30,2099-12-31,NA
37171962,"Prolapsed lumbar intervertebral disc, L3-L4",Condition,SNOMED,Disorder,S,43381000087106,2023-06-30,2099-12-31,NA
37171965,"Prolapsed lumbar intervertebral disc, L4-L5",Condition,SNOMED,Disorder,S,43401000087106,2023-06-30,2099-12-31,NA
37171968,"Prolapsed lumbar intervertebral disc, L5-S1",Condition,SNOMED,Disorder,S,43411000087108,2023-06-30,2099-12-31,NA
37171970,"Prolapsed thoracic intervertebral disc, T11-T12",Condition,SNOMED,Disorder,S,43421000087100,2023-06-30,2099-12-31,NA
37171972,"Prolapsed thoracic intervertebral disc, T12-L1",Condition,SNOMED,Disorder,S,43431000087103,2023-06-30,2099-12-31,NA
37174314,Occipitoatlantoaxial spine ankylosis,Condition,SNOMED,Disorder,S,8281000119109,2022-03-31,2099-12-31,NA
37203959,Ankylosing spondylitis co-occurrent with anterior uveitis,Condition,SNOMED,Disorder,S,786077003,2019-07-31,2099-12-31,NA
37207722,Disorder of joint of lumbosacral vertebra,Condition,SNOMED,Disorder,S,130731000119100,2019-07-31,2099-12-31,NA
37207774,Disorder of ligament of vertebral joint,Condition,SNOMED,Disorder,S,306121000119103,2019-03-01,2099-12-31,NA
37207791,Fistula of vertebral joint,Condition,SNOMED,Disorder,S,307951000119105,2019-03-01,2099-12-31,NA
37207834,Subluxation complex of cervical vertebra,Condition,SNOMED,Disorder,S,322111000119104,2019-07-31,2099-12-31,NA
37207835,Subluxation complex of lumbar vertebra,Condition,SNOMED,Disorder,S,322141000119100,2019-07-31,2099-12-31,NA
37207838,Hemarthrosis of vertebral joint,Condition,SNOMED,Disorder,S,324031000119103,2019-03-01,2099-12-31,NA
37309677,Arthritis of facet joint of thoracic spine,Condition,SNOMED,Disorder,S,16426601000119103,2020-01-31,2099-12-31,NA
40479848,Seronegative arthritis of joint of spine,Condition,SNOMED,Disorder,S,444556003,2010-07-31,2099-12-31,NA
40480185,Disorder of articular cartilage of vertebral column,Condition,SNOMED,Disorder,S,444578005,2010-07-31,2099-12-31,NA
40482807,Disorder of lumbar disc,Condition,SNOMED,Disorder,S,443700006,2010-01-31,2099-12-31,NA
40483292,Displacement of cervical intervertebral disc,Condition,SNOMED,Disorder,S,445332006,2010-07-31,2099-12-31,NA
40483750,Loose body in joint of spine,Condition,SNOMED,Disorder,S,445438006,2010-07-31,2099-12-31,NA
42536660,Prolapse of cervical intervertebral disc with degeneration,Condition,SNOMED,Disorder,S,735604001,2018-01-31,2099-12-31,NA
42536661,Degeneration of thoracic intervertebral disc without prolapse,Condition,SNOMED,Disorder,S,735606004,2018-01-31,2099-12-31,NA
42536662,Prolapse of thoracic intervertebral disc with degeneration,Condition,SNOMED,Disorder,S,735607008,2018-01-31,2099-12-31,NA
42536663,Degeneration of thoracic intervertebral disc and osteophyte,Condition,SNOMED,Disorder,S,735608003,2018-01-31,2099-12-31,NA
42536664,Degeneration of lumbar intervertebral disc without prolapse,Condition,SNOMED,Disorder,S,735609006,2018-01-31,2099-12-31,NA
42536665,Degeneration of lumbar intervertebral disc and osteophyte of lumbar vertebra,Condition,SNOMED,Disorder,S,735611002,2018-01-31,2099-12-31,NA
42536749,Traumatic subluxation of spine due to birth trauma,Condition,SNOMED,Disorder,S,735743006,2018-01-31,2099-12-31,NA
42539035,Prolapse of lumbar intervertebral disc with degeneration,Condition,SNOMED,Disorder,S,735610001,2018-01-31,2099-12-31,NA
42539281,Ossification of anterior longitudinal ligament of spine,Condition,SNOMED,Disorder,S,10624571000119106,2018-01-31,2099-12-31,NA
42539491,Degeneration of cervical intervertebral disc and osteophyte of cervical vertebra,Condition,SNOMED,Disorder,S,735605000,2018-01-31,2099-12-31,NA
42573204,Cervical malformation - malarticulation,Condition,SNOMED Veterinary,Clinical Finding,S,356691000009106,2014-07-19,2099-12-31,NA
42596344,Dislocation of intercoccygeal joint,Condition,SNOMED Veterinary,Clinical Finding,S,311081000009100,2009-12-10,2099-12-31,NA
42596396,Spondylosis deformans of lumbosacral joint,Condition,SNOMED Veterinary,Clinical Finding,S,311571000009109,2009-12-11,2099-12-31,NA
42596663,Lumbar intervertebral disk disorder,Condition,SNOMED Veterinary,Clinical Finding,S,314141000009109,2009-12-30,2099-12-31,NA
42597424,Intervertebral disc rupture of twelfth thoracic vertebra,Condition,SNOMED Veterinary,Clinical Finding,S,32291000009106,2008-06-13,2099-12-31,NA
42598478,Ankylosis of coccygeal vertebrae,Condition,SNOMED Veterinary,Clinical Finding,S,33331000009108,2008-08-29,2099-12-31,NA
42598482,Bacterial discospondylitis of cervical spine,Condition,SNOMED Veterinary,Clinical Finding,S,333371000009107,2013-09-09,2099-12-31,NA
42598483,Discospondylitis of cervical spine,Condition,SNOMED Veterinary,Clinical Finding,S,333381000009109,2013-09-09,2099-12-31,NA
43021195,Broad based intervertebral disc protrusion,Condition,SNOMED,Disorder,S,472979002,2013-01-31,2099-12-31,NA
43021196,Focal intervertebral disc protrusion,Condition,SNOMED,Disorder,S,472980004,2013-01-31,2099-12-31,NA
43531130,Internal disc disruption,Condition,SNOMED,Disorder,S,608829007,2013-07-31,2099-12-31,NA
44783242,Lumbar arthritis,Condition,SNOMED,Disorder,S,699302001,2014-01-31,2099-12-31,NA
44783263,Sequestrum of intervertebral disc,Condition,SNOMED,Disorder,S,699332009,2014-01-31,2099-12-31,NA
44783372,Migrated disc extrusion,Condition,SNOMED,Disorder,S,699456009,2014-01-31,2099-12-31,NA
44783790,Radial tear of annulus fibrosus of intervertebral disc,Condition,SNOMED,Disorder,S,697975004,2014-01-31,2099-12-31,NA
44784077,Open division of ligament of thoracic vertebral column,Condition,SNOMED,Disorder,S,699980004,2014-01-31,2099-12-31,NA
45757549,Dysfunction of cervicothoracic region,Condition,SNOMED,Disorder,S,19441000119107,2014-07-31,2099-12-31,NA
45771002,Spondyloarthropathy due to hemodialysis-associated amyloidosis,Condition,SNOMED,Disorder,S,707090004,2015-01-31,2099-12-31,NA
46270474,Primary chronic gout without tophus of vertebra,Condition,SNOMED,Disorder,S,310081000119100,2015-07-31,2099-12-31,NA
46273196,Bacterial arthritis of atlantoaxial joint,Condition,SNOMED,Disorder,S,712524006,2015-07-31,2099-12-31,NA
46273215,Bacterial arthritis of facet joint of thoracic spine,Condition,SNOMED,Disorder,S,712547007,2015-07-31,2099-12-31,NA
46273216,Bacterial arthritis of facet joint of lumbar spine,Condition,SNOMED,Disorder,S,712548002,2015-07-31,2099-12-31,NA
46273406,Undifferentiated spondyloarthropathy,Condition,SNOMED,Disorder,S,85611000119105,2015-07-31,2099-12-31,NA
46273622,Bacterial arthritis of facet joint of cervical spine,Condition,SNOMED,Disorder,S,712549005,2015-07-31,2099-12-31,NA
46287150,Intervertebral disc disorder with radiculopathy,Condition,SNOMED,Disorder,S,943471000000108,2015-04-01,2099-12-31,NA
